author_name,author_from,comment_title,comment_body,comment_date
Maíra Almeida,"Dois Vizinhos, PR",Ótimo local para caminhadas e passeio!!,"Fui com minha família visitar o parque, não fomos para fazer caminhada nem nenhum exercício físico, mas achei um local muito harmonioso e propicio para isso, além oferecer um amplo espaço e ser um local limpo e movimentado por várias pessoas. Possui também uns quiosques, o açaí", setembro de 2017
WalterBlount,"Curitiba, Pr",Como sempre o parque da cidade,"Fim de semana perfeito, céu azul, calor e um dia maravilhoso p/ caminhar e curtir esse parque que é a cara da cidade.", agosto de 2017
MHSJC,,Passeio de Domingo,Local muito agradável!  Ambiente bastante familiar e seguro. Excelente infraestrutura. Recomendo à todos!, setembro de 2017
Huander,"Curitiba, PR",Passeio em família ,"O parque oferece espaços a todos os grupos de pessoas, velhos jovens, casais, solteiros entre outros.  A estrutura eh bem desenvolvida.  O maior problema atual do parque eh a falta de segurança.  Os animais do parque são uma diversão a parte :)", setembro de 2017
CrislaineRJ,"Rio de Janeiro, RJ",Pôr do sol ,"Fui ao Parque Barigui para ver o pôr do sol, e não me decepcionei, muito bonito mesmo, além do parque em si já ser muito bonito, vale fazer uma caminhada por lá! ", junho de 2017
L_Y_S_R-J,"Rio de Janeiro, RJ",Atividades fisicas,"Adorei o parque. Fiquei impressionada como ele é bem cuidado. Seu gramado impecável. As pessoas que vivem por lá, utilizam o parque para caminhadas e atividades físicas. Apesar de o tempo estar nublado, o parque continuou exuberante. Local muito agradável para espairecer,", outubro de 2016
Masseli_Costa,"Curitiba, PR",Para realizar uma atividade física ou simplesmente passear,Este é um dos mais antigos parques da cidade e para quem vem do interior do PR via BR 277 é logo avistado chegando em Curitiba. Para os que gostam de praticar atividade física possui uma pista plana com aproximadamente 5 Km. Também é uma boa pedida para passear com a família em, agosto de 2017
Daniel_Kenji,"Indaiatuba, SP",Bom lugar para uma corridinha.,"Achei muito interessante a divisão das vias para caminhada, jogging e bike, a maioria das pessoas respeitam as faixas. Opção de volta de 3,5km e 1,7km. Fui em uma noite muito fria e com garoa e por isso estava bem vazio. Em alguns lugares falta iluminação e sinalização.", setembro de 2017
Newton Froes,,Caminhar é preciso.,"O Barigüi, é a praia do Curitibano, nos finais de semana, o fluxo de pessoas é muito alto. O Parque conta com um Centro de Exposições, com atividades rotineiras,  algumas barracas de água de coco  e caldo de cana, um Restaurante que do abre a noite, é um bar  (deck). Para se", agosto de 2017
sonia s,"Rio de Janeiro, RJ",Ótima atração para um dia de sol,"Parque muito bonito, bem acessível, podendo ser desfrutado por jovens, familiares com crianças que desfrutarão de grande liberdade p brincar. Ao chegar no parque pude almoçar num bom restaurante dentro do parque. Com um cardápio bom e preço acessível. Único senão foi ao pedir a", agosto de 2017
luciani2014,"Vila Velha, ES",AH OS PARQUES DE CURITIBA,Um dos parques mais deliciosos de Curitiba!! com seus lagos e locais para caminhadas..delicia para o corpo e deleite para os olhos!!, agosto de 2017
marisa_e_moreno,Curitiba,Parque Barigui ,"Excelente lugar para relaxar, fazer caminhadas ou comer.  Para quem gosta de correr ou andar de bicicleta, patins ou skate tb é um lugar aconselhável! Mesmo para que gosta de simplesmente admirar a natureza tb é um lugar mto propício. ", agosto de 2017
Adilson T,"Santos, SP",Paz e segurança,Meu lugar preferido para uma boa caminhada e corrida. Pela manhã é muito tranquilo mesmo aos finais de semana. Muito limpo e seguro.  Parabéns aos mantenedores, agosto de 2017
Pri Giovana,,Parque excelente para caminhada,"Com um grande lago e uma pista em volta dele para fazer caminhada, também é ótimo para sentar e curtir a paisagem, o gramado tem bastante espaço para se sentar e até fazer um piquenique.", dezembro de 2016
Cristiane P,,Maravilhoso,"É um dos maiores parques de Curitiba, com uma área de 1,4 milhão m², que fazia parte da sesmaria do capitão-povoador Mateus Leme. Foi transformado em parque em 1972. Possui várias opções de lazer, inclusive o museu de Automóveis que é incrível. Pode se inclusive fazer um passeio", fevereiro de 2017
Schirley,"Curitiba, PR",Otima caminhada! Vista linda! ,Adoro passear neste parque pois depois da caminhada posso sentar num bar ou restaurante e apreciar a vista. Há banheiros públicos meio precários mas quebram o galho!  Cuidado ao andar pela grama pois muitos levam seus cachorros e não recolhem as fezes dos bichinhos. Há uma pista, agosto de 2017
Luciene,"Curitiba, PR",Lindo lugar para uma caminhada,O Parque Barigui é um lindo lugar para uma caminhada ao redor do lago ou uma cervejinha no final de uma tarde ensolarada no bar do deck sobre o lago., agosto de 2017
Luciando M,Barcelona ,Congresso ,Fui a um congresso no parque barigui e fiquei encantado com o parque : um lindo lago com um granado perfeito . Tem churrasqueira cobertas pra quem quiser vir com a família passar o dia . Uma pist de caminhada ou cooper . , agosto de 2017
eugeniosantosrj,"Rio de Janeiro, RJ",PAQUE BARIGUI,"Parque amplo, bom pra atividades físicas, passeio com a família, relaxar, e vislumbrar a natureza. Visita obrigatória pra quem visita Curitiba.", julho de 2017
Sara R,,melhor da cidade,"Curitiba possui muitos parques e praças, mas para mim, o Parque Barigui é o melhor deles. Lindo de dia e a noite. bom para relaxar, fazer exerci´cios ou tomar aquela gelada com os amigos no deck ou casa amarela.", agosto de 2017
Natinha1977,"São Paulo, SP",Tranquilidade para caminhar!,"O parque é bem tranquilo para caminhada ou se preferir tem locação de bicicletas na entrada. Bem arborizado, tem um belo lago e playground para crianças.", julho de 2017
Kimberly Oro,"Curitiba, PR",Visita certa,"É o ponto de encontro do pessoal esportivo e das famílias de Curitiba. Um ótimo programas para os dias de sol. O parque conta com pistas de caminhada, ciclovia, espaço para skate e roller, máquinas para exercício ao ar livre e espaço para aeromodelismo. O parque ainda conta com", julho de 2017
Júlia Ortiz,"Curitiba, PR",Vale muito a visita!,"Amplo estacionamento, muita área verde, pista de passeio, corrida e outros (bike, skate, patins, etc.). Lugar perfeito tanto para quem quer praticar atividades físicas, quanto para quem deseja um momento ao ar livre. Perfeito também para quem deseja levar os pets para um super", julho de 2017
Laura F,"Florianópolis, SC",Lindíssimo,"Parque muito bonito e limpo. Tem um local no estacionamento onde é possível alugar bicicletas elétricas, pagamos R$15,00 por 30min, o suficiente para dar a volta no parque. No parque tem banheiro, malocas e pista de aeromodelismo. Vários bichinhos vivem soltos no local. Em", agosto de 2017
Naestradadenovo,"Paranavaí, PR",Parque para todos os gostos,"Parque para correr, caminhar, brincar, pedalar, fazer piquenique, andar de skate ou roler... Enfim dá pra fazer tudo! No finais de semana com sol é muito cheio, mas mesmo assim uma delicia! Oferece um por do sol lindo. Tem vendedores ambulantes tipo de pipoca algodão doce etc... ", agosto de 2017
Henrique P,"São Paulo, SP",Congresso em Curitiba,"Parque e Expo Barigui muito bem localizados, local com infra e estacionamentos, além de um excelente visual.", agosto de 2017
Claude R,Curitiba,Ótimo para correr ou caminhar,"Parque lindo, maravilhoso para correr ou caminhar, levar os dogs para passear, ou simplesmente passar uma tarde de boa.", novembro de 2016
ricardoemm,"Natal, RN",Polivalente ,"Parque bonito, limpo, bem cuidado. Adequado para prática esportiva. Interessante para Familias com crianças. Além disso,  comporta tranquilamente eventos grandes em seu centro de convenções, que é moderno e tem uma logística favorável para congressistas.", agosto de 2017
Monique A,,Parque enorme e lindo,"Local muito bacana pra uma tarde tranquila. Muitas famílias, crianças, cães.  Tem um bar com deck no lago muito bom.", agosto de 2017
Ana M,"São Paulo, SP",Lindo pra ir de dia ou a noite,"O parque tem vários restaurantes noturnos..Lindo, parece parque de outro país. Grande e vc pode ficar todo o dia", junho de 2017
Daniel Freire,"Vitória, ES",Parque ótimo para corrida,"Parque muito bonito, como todos em Curitiba. O legal é você alugar uma bike para poder fazer o passeio e ainda praticar exercicios. Vá em todos os parques e praças de Curitiba, cada um tem seu toque especial. ", agosto de 2017
Dedê Nunes,"Curitiba, PR",E a praia do curitibano,"Para todos os tipos de usuários. Os de final de semana vêem descansar, trazer as crianças e cachorros para passear, (programa de família). Durante a semana, muitos vêem para caminhar e correr. Diversas assessorias esportivas utilizam o espaço do parque para  fazerem atividades", agosto de 2017
Juliani C,"Taubaté, SP",Muito bom!,Parque Barigui é programa ideal pra que está em Curitib com tempo sobrando. Uma corrida em volta do parque renova todas as energias. As crianças adoram., agosto de 2017
Marcela Campolino,"Jundiaí, SP",Bacana,"Muito grande o lugar, bonito, da para fazer varias estividades em família. Possui estacionamento gratuito.", abril de 2017
Samuel B,"Marau, RS",Parque pro Verão,"Bom pra descansar, tomar um Sol, e jogar conversa fora... vale a pena conhecer e muito mais, aproveitar pra praticar um esporte.. ", setembro de 2016
ftimail,"Curitiba, PR",Bom para família,"Ótimo parque, muito bem cuidado e com boa segurança.Local perfeito para passear com a família ou fazer exercícios ao ar livre. Muito próximo de shoppings, comércios e prédios residenciais. Vale a pena conhecer!", agosto de 2017
Patricia M,"São Paulo, SP",Ótimo parque,"Quem for a Curitiba vale conferir o parque, lugar tranquilo com muito verde,super recomendo, lugar incrível.", setembro de 2016
Geisa T,"Rio de Janeiro, RJ",Aproveite para pedalar!,"O parque é enorme, com ciclovia em todo seu entorno, pessoas vão para se exercitar ou relaxar com a vista! Trecos de sol e sombra, muito agradável! Alugue uma bicicleta e aproveite o passeio!", agosto de 2017
flaviodesouza55,"Curitiba, Brasil",ATRAÇÕES PARA MUITOS GOSTOS,"Este é o maior parque de Curitiba, que tem uma parte com um dos poucos pedaços ainda existentes da Mata Atlântica. Tem um lago enorme, com uma pista para andar/correr/patinar/bicicletar que dá toda a volta. em um dos pontos da margem tem um restaurante onde se pode beber um", setembro de 2016
Thaís Yuana D,Curitiba,Lindíssimo!,"É um ótimo lugar pra passar o domingo, quando aparece o sol, rsrs. Mas também é super lotado. Não é indicado andar por lá a noite, é super perigoso. Mas vale a pena conhecer!", junho de 2017
Rayene Paola L,,Parque lindo,"Adorei o parque. Ele é organizado, muito bonito e também é possível alugar bicicletas. Vi capivaras, peixes e várias espécies de pássaros. Há uma placa informando da presença de um jacaré de papo amarelo, mas não o vi no dia em que fui.", agosto de 2017
Edivania T,,Bom,"Curitiba é uma cidade com muitos parques, mas esse não é o meu preferido. Ele é ideal para quem quer correr, caminhar ou praticar esportes. ", agosto de 2017
Tatiana,"Pato Branco, PR",Bem lindo,"Local tranquilo, ótimo para  um passeio em família. Os patos e capivara que ficam por lá são bem mansinho. Gostei bastante. ", agosto de 2017
Sandra W,"Curitiba, PR",Corrida no parque,"Excelente local para caminhadas e ou corridas  E plano e a volta pode ser de 3,6 ou completa com 5,4 Km  Lugar muito bom para se exercitar e apreciar a natureza!!!", julho de 2017
tereza b,"Curitiba, PR",Ótimo local para atividades físicas e para relaxar.,"É considerado um dos maiores parques e é também o mais antigo. Para quem vai de carro há bastante espaço para estacionamento, tanto para quem chega pela BR 277 como para quem chega pela Candido Hartmann. O parque tem o nome de Barigui por conta do Rio que foi represado dando", julho de 2017
Nadia Luciani,,O maior parque de Curitiba!,"O parque Barigui recebe de braços abertos, com belíssimos nascer e por do sol, todo visitante, morador da cidade ou não. Imperdível!!!!!", julho de 2017
Elena S,,Parque da cidade,Melhor parque. Vista bonita. Tem um ar de praia dos moradores da cidade. Passeio imperdível para turistas., agosto de 2017
Bianca D,"Curitiba, PR",Símbolo da cidade,O parque mais conhecido. Fácil acesso e muito bem conservado. Lindo em qualquer epoca do ano. As familias de capivaras são um show a parte!, agosto de 2017
Ricardo M,"Luxemburgo, Bélgica",Barigui: o principal parque de Curitiba,"Ótima opção de lazer e esporte, especialmente caminhada, corrida, ciclismo com pistas diferentes cada cada uma dessas modalidades. ", agosto de 2017
claudiasacaki,"Curitiba, PR",Saudável,"O parque Barigui além de ser lindo, te dá a oportunidade de caminhar, correr, andar de bike etc, ou seja, aproveitar a natureza fazendo uma atividade física, ou mesmo para sentar na grama e bater papo com os amigos, ou tomar uma cervejinha no deck no final da tarde, para todos:", agosto de 2017
Robson M,"São Paulo, SP",Ótimo para que correr!,"O Barigui é ótimo para correr, ele é bem grande sendo poucas voltas para completar alguns kilometros, tem um lindo lago, você pode fazer lancheis em na lanchonete que fica em um pier ou até tomar um delicioso sorvete na sorveteria que tem ao lado da lanchonete vale a pena é", fevereiro de 2017
Bruno H,"Santos, SP",Muita natureza e paz,"Parque muito grande com fácil acesso e várias vagas de estacionamento gratuitas, possui vários patos, marrecos e outros animais que andam livremente por toda sua extenssão, ótimo passeio para quem quer aproveitar um pouco a natureza, conta com pista de cooper e churrasqueiras", agosto de 2017
Leticia27Fernandes,,Muito lindo ,Lugar incrível nao conhecia ainda mas foi uma das melhores experiência do dia bem espaçoso limpo natureza seguro e com varios comércios , agosto de 2017
Teresinha M,"Curitiba, PR",excelente espaço para sociabilização e prática de esportes,"Neste local você faz novas amizades e congratula com outros amigos, além de caminhar, praticar exercícios ao ar livre com aparelhos, aprende a usar roller ou simplesmente relaxa deitado na grama e observando o linda paisagem e as pessoas que por lá desfrutam do tempo livre.", julho de 2017
Brasilipino,Paraná,bom para caminhadas e corridas,"Ponto de referência na cidade. Visita praticamente obrigatória. Às vezes o lago está com mau cheiro e em alguns finais de semana está muito cheio, mas ainda assim compensa.", outubro de 2016
AllanaScheliga,"Curitiba, PR","É lindo, mas tem lugares melhores","Nada melhor do que a opinião de quem mora no lugar, pelo menos é o que eu acho. Pois bem, moro em Curitiba e conheço muito bem os parques da cidade e posso dizer, o Parque Barigui é lindo, mas se você vem com intenção de turismo cultural, ecológico e para tirar muitas fotos,", julho de 2017
Sheila J,"Indaial, SC",Melhor parque,"Com certeza, o melhor parque: dá vontade de pegar uma bike e pedalar por tudo. Tem muitos espaços para os mais variados esportes. É beeem grande, então dá pra passar muito tempo por lá, sem ficar entediado. É lindo, a estrutura é muito boa, foi o meu local preferido de Curitiba.", julho de 2017
Michelle Segantini,"São Paulo, SP",Ótimo para uma caminhada ao ar livre,"Perfeito para uma caminhada ao ar livre e para a prática de esportes, contato com a natureza com  organização e segurança, lugar lindo e limpo. Bom para curtir com a família.", maio de 2017
Roberto T,"Joinville, SC","Longe, mas se estiver por perto vale a pena","É um pouco longe do Centro. Se estiver por perto vale a pena visitar, é bem grande e tem um Shopping interessante.", fevereiro de 2017
Alejandro S,"Curitiba, PR",Pra um passeio,"É o melhor parque da cidade, tem boa infraestrutura gastronômica e de lazer, o bar que tem no pier é imperdoável, o restaurante serve feijoadas aos sábados e tem vários eventos durante o ano.", julho de 2017
José Augusto Viana,"Curitiba, PR",Belo parque,"Excelente local para atividades físicas, tanto para corrida, andar de bicicleta ou caminhada. Espaço para fazer churrasco, além de parquinho com brinquedos para crianças.", julho de 2017
Luiz Henrique,"São José do Rio Preto, SP",Vale a pena conhecer,"Este é um otimo lugar de lazer, um dos mais bonitos cartões postais da cidade. Vale a pena conhecer e passar umas horas neste e desfrutar deste ambiente muito bom.", março de 2017
Paola F,"Valinhos, SP",Bom para uma corrida,"Para quem gosta de correr este é o local. Pista ao redor de um lago , com extensão de 3,2 km. Sempre lotado. Mas vale a pena.", julho de 2017
Cintia.Vix,"Vitória, ES",O belíssimo Parque Barigui,"Curitiba tem inúmeros parques, mas o Barigui é um dos melhores para caminhadas e piqueniques. O visual é lindo, e há uma boa infraestrutura no local. Passeio gratuito, ideal para todas as idades.", julho de 2017
Fábio F,,Ótimo para a família,"Foi  segundo parque que mais me agradou em Curitiba. Ótimo para levar crianças e fazer caminhadas. Bem grande o espaço. É parecido com outros da cidade, mas este tem o contato do homem com animais, tipo patos e capivaras. Vale a pena visitar!", julho de 2017
Victor C,,PARQUE DA FAMÍLIA,"O referido parque possui infraestrutura adequada aos que o frequentam; limpeza e locais agradáveis para passear com a família; porém temos visto o consumo de drogas em locais mais ermos do parque, principalmente à noite; por outro lado, tive problemas na utilização de banheiros", junho de 2017
Otilia C,Santo André,Parques,"Um local muito bonito e bem cuidado. Eu e minha família gostamos muito, pena que segundo fomos  informados, atualmente o local vem se tornando perigoso, com assaltos frequentes. Acredito que necessite um policiamento mais constante, pois durante o período que estivemos ali, não", julho de 2017
Jana_Maffei,bauru,Bom para caminhada,"O parque tem muita atividade de esportes, várias pessoas caminhando , correndo e andando de bike. Legal para conhecer mas é um parque com um foco mais para atividades esportivas.", julho de 2017
christian g,"Caxambu, MG",excepcional ,"Lindo, bem cuidado, ótimo para caminhadas, exercícios ao ar livre, admirar o lago ou simplesmente relaxar.", julho de 2017
hhcavalcante,"Curitiba, PR",Parque mais lindo de Curitiba,"Visita imperdível para quem visita e cidade. Lugar para caminhar, admirar, espairecer e relaxar. Parque mais procurado para caminhar, correr e fazer atividades físicas ao ar livre. Tem quiosques com água de côco e caldo de cana.", julho de 2017
Roberta N,,Passeando ,"  O parque barigui é bom, limpo, organizado e excelente para quem gosta de fazer atividades físicas!   Um bom passeio para todas as idades!!", julho de 2017
Marcussader,"Ubiratã, PR",Tranquilidade,"O Parque Barigui é um lugar maravilhoso, com paisagens deslumbrantes e uma variedade muito grande de atividades que podem ser realizadas no local", julho de 2017
Simone N,"Curitiba, PR",Um oásis no meio da cidade ,"Moro em Curitiba desde que nasci e me mudei pra região do parque Barigui um pouco antes de meu filho nascer. Frequento o parque regularmente  e posso afirmar que em matéria de parques urbanos não fica devendo nada pra ninguém. Tem espaço pra quem se exercitar, pra quem quer", julho de 2017
Gisele W,"Cubatão, SP",Lugar lindo,"Ótimo local para praticar esporte, ou ficar deitado na grama, o local é bem grande e na entrada eles alugam bicicletas.", julho de 2017
Frederico Kochem,"Petrópolis, RJ",Passeio de Helicóptero ,"O parque tem um lago muito bonito e agradável. Para quem gosta de aventura, o passeio de helicóptero dá uma boa oportunidade para fotografar. ", julho de 2017
noemia1109,"Santa Cruz do Rio Pardo, SP",cartao postal,"parque barigui tem uma bela vista da cidade, tem um museu do automovel proximo do parque, regiao muito gostosa, otimo para quem pratica esporte", junho de 2017
Clarisse M,"Macaé, RJ",Lindo,"Lindo espaço natural, com um lindo lago. Possui ainda quiosque no local. Finais de semana é comum ver inúmeras famílias reunidas para piquenique, brincadeiras, etc.", julho de 2017
77anafortes,"São Paulo, SP",Lindo!!!,Amei esse parque!!! As crianças correram e brincaram muito. Super bem cuidado!!! Vale a pena fazer um piquenique. Transmite paz e aconchego!!! Passaria o dia só contemplando a natureza!, julho de 2017
Livia A,"Fortaleza, CE",Excelente para atividades físicas ,"Este foi o parque no qual eu mais gostei de Curitiba, pois além de lindo ele é muito bem estruturado. Possui uma pista exclusiva para ciclista, outra exclusiva para caminhada e outra exclusiva para corrida.  Conta também com estacionamento gratuito e sem flanelinhas ao longo de", julho de 2017
MarcioAugustoBH,"Belo Horizonte, MG",Ótimo para caminhadas e bike!,"Parque bem cuidado, ótimo para caminhadas ao redor do lago. Alugamos bicicletas elétricas num trailer em frente ao museu do automóvel, R$ 15,00 meia hora. Tem uma trilha pela mata muito boa também.", julho de 2017
pfigsousa,"Rio de Janeiro, RJ",Recomendo!!,"Local enorme!!! Os parques em Curitiba são abertos, não há muros ou portões, achei isso interessante. Então há parque dos dois lados da rua. Quem não gosta de caminhar provavelmente não gostará, eu adorei! Há capivaras e outros animais. ", julho de 2017
rosanamatheus,"Curitiba, PR",Lindo !!,"Ótimo para caminhar, correr , um belissimo piquenique , excelente para as crianças. Totalmente recomendável !!!", julho de 2017
MonicaLaplace,"Rio de Janeiro, RJ",Maravilhoso,"Parque plano e aberto ao público com espaço delimitado para caminhantes, corredores e ciclistas. O lago é particularmente lindo no por do sol.  ", julho de 2017
Andre A,,Passeio tranquilo ,"Bom passeio pra abstrair e curitir um ambiente super tranquilo. Por do sol é  bem bonito! A única coisa ruim é , se vc n for com antecedência, perde-se um tempo razoável no trânsito  are chegar ao parque ( caso n more perto) e caso vc n seja da cidade. Haha ", junho de 2017
Marcelo P,,A praia do Curitibano,No domingo de sol passeamos por todo o parque. Os curitibanos amam esse parque o cuidam como muito carinho. Tem um lago lindo e uma excelente área de lazer com churrasqueiras. Vários pontos para tomar uma água de coco. O passeio vale para turistas de todas as idades com ou sem, junho de 2017
Ana Paula L,,Prática de esportes,"Conheci o parque num dia extremamente frio, por isso não havia muitas pessoas. Tive a impressão de que o local é mais destinado para caminhada, corrida e outros esportes. O parque é bonito, limpo, bem cuidado e não é muito grande. Há banheiro público, mas há também um que é pago.", julho de 2017
Bocao100,"Porto Velho, RO",Parque muito legal!,Eu e minha esposa corremos no parque várias vezes e adoramos!  Excelente localização e estrutura!  Vale a pena visitar!!!, julho de 2017
handerson f,"Varginha, MG",Enorme,"Parque muito grande com lindo lago,muito verde,pontes e excelente lugar para passear,correr,namorar ou simplesmente fazer uma caminhada,tem várias mansões e até uma igreja.", julho de 2017
Isabella R,"Campos dos Goytacazes, RJ",Recomendo!,"Delícia de parque. Passear, fazer uma caminhada, ou tomar um choppinho do deck do barzinho, de frente pro lago.", julho de 2017
ClaucePalmas_Brazil,"Palmas, TO",Belíssimo.,"O parque Barigui é belíssimo, possui um lago enorme com vários patinhos nadando. Excelente para fazer caminhadas, andar de bicicleta, levar as crianças para brincar ou simplesmente passear. Tem restaurante, lanchonete, alguns carrinhos de pipoca. Tem um local que aluga", julho de 2017
Norberto M,"Natal, RN",Adorei,"Tinha uma expectativa do parque e saí com outra. O parque possui boa estrutura de banheiros e lanches. Há a possibilidade de locar bicicletas. Alugamos e andamos por todo o parque. Bom demais. Fiz a visita na quarta-feira e o parque estava tranquilo. Já no domingo, quando", julho de 2017
LuizNeves,"Campinas, SP",Urbano e relax ,"Parque fica na borda da região nobre da cidade, mas tem mata e espelhos d'água. Como  maioria dos parques de Curitiba, possui uma infraestrutura útil e bem cuidada. Bom de conhecer e desfrutar.", julho de 2017
Wagner K,"Serra, ES",Um oásis na cidade,"Um local agradável, com um belo espelho d'água, convidativo para o passeio no entorno e para atividades esportivas.", julho de 2017
Denilson A,,Lindo lugar,"Gostei muito  de ver as capivaras, os patos  lugar muito bonito., bem arborizada  e com  pessoas fazendo  caminhadas! ", julho de 2017
Alexandre M,"Ribeirão Preto, SP",Excelente,"Uma área enorme para a prática esportiva , corridas, bicicletas ou apenas para apreciar a bela vista do parque, a pista tem 5km de extensão, vale a pena passar por lá.", julho de 2017
Nuria Sabrine G,"Termas de Ibirá, SP",Lindo,Um dos parques mais lindos da cidade de  Curitiba. Tiramos muitas fotos legais. Vale muito a pena conhecer., junho de 2017
MariMoura,"Curitiba, PR",Parque chamado ``A Praia dos Curitibanos``,"Parque agradável para passeio a pé com crianças e pets também, local com bares. vegetação exuberante ...", julho de 2017
Repetrus,"Brusque, SC",Lindo,"O parque é muito lindo, bem conservado. Um ponto negativo para quem é turista é ter poucas opções de aluguel de bicicletas por exemplo.", julho de 2017
