author_name,author_from,comment_title,comment_body,comment_date
Julio Flavio F,"Volta Redonda, RJ",Caminhada e Paz,"Sempre gosto de fazer uma caminhada e neste Parque além de ser um lugar muito Bonito e agradável, senti muita Paz. Excelente.", setembro de 2016
LuizLimaReis,"Rio de Janeiro, RJ",Sensação de paz !,Lindo parque com uma ótima infraestrutura. Ótima opção para quem pratica esportes e gosta de correr nos finais de semana. Possui uma longa extensão e uma bela paisagem no decorrer do caminho., outubro de 2016
brunalmeida89,"Niterói, RJ",Natureza,"O principal parque da cidade de Curitiba, ótimo para apreciar a natureza e observar as capivaras com a família.", maio de 2016
Neide L,,Passeios,"Muito agradavel, bom para fazer algumas atividades fisicas ou  ficar sentado no gramado lendo um bom livro numa tarde de domingo ou mesmo ficar apenas conversando com os amigos.", outubro de 2016
Diego Palladino,"Curitiba, PR",O melhor da cidade!,"Ponto turístico de Curitiba, não deixem de conhecer esse maravilhoso presente que a cidade oferece. Ótimo para caminhar e correr, possui espaço para alongamentos, banheiro público e estacionamento.  Amo o Barigui", outubro de 2016
Wilson Rocha,,Excelente!,"Tem ótima infraestrutura. Apesar de visitá-lo por pouco tempo, vi muitas pessoas caminhando, correndo, andando de bicicleta e praticando esportes. O parque é muito agradável, excelente!", outubro de 2016
Elizane S,,Ótimo,"ótimo para caminhadas e descansar olhando as belas paisagens, passeios em família e amigos, apreciar a natureza.", março de 2016
AndrioPeres,"São Bernardo do Campo, SP",O melhor parque,"Parque público muito bem localizado e também bem cuidado, moro na cidade e garanto satisfação total para praticas de esportes, passeios e também para namorar! Sem contar a natureza que é bela... Vem pro barigui!!", setembro de 2016
nestorlcamargo,"Barueri, SP",Presente da Natureza,"Lugar maravilhoso, muito bem cuidado, frequentado por muita gente educada. Ideal para respirar ar puro e praticar atividades físicas.", setembro de 2016
AnaLu C,"Maringá, PR",Parque mais conhecido de Curitiba,"É o parque mais tradicional de Curitiba e um local ideal para aqueles que desejam fazer uma caminhada, corrida, bicicleta ou apenas desfrutar de alguns momentos ao ar livre.", outubro de 2016
Lukas B,,Parque  muito bom para tudo ,Um ótimo lugar para praticar esporte  como caminhada corrida  ciclismo  além disso cada tipo de esporte tem seu local para ser praticado como pista de corrida  e caminhada separada e de ciclismo  também... quadra  de vôlei  academia  ao ar livre  e lista para prática  patinação , outubro de 2016
Evelin M,Estado de São Paulo,"Ar puro, tranquilidade e natureza","Passamos uma agradável manhã no Parque Barigui, um lugar super convidativo para caminhar, andar de bicicleta, correr ou simplesmente apreciar a natureza. Bastante tranquilo e arborizado, o parque possui uma infraestrutura bacana para quem quer curtir com a família e tem", outubro de 2016
gabrielle_ventura318,"Rio de Janeiro, Brasil",Otimo para pedalar,"Alugamos bicicletas motorizadas e demos um ótimo passeio pelo parque. Belas paisagens, muito verde e encontramos até capivaras. Super indico", outubro de 2016
Tainara F,,Parque Lindo!,"Fiquei impressionada com a conservação deste lugar! Espaço ideal para atividades física, crianças e apreciar a natureza!", setembro de 2016
Giseli C,"São Paulo, SP",Lindo parque,"É uma ótima estrutura tem este parque em Curitiba, ampla área e muito bem dividido as pistas, vários locais para tomar sol ou aquele caldo de cana.", outubro de 2016
jchuves,"Curitiba, PR",Running...,"Um lugar excelente para praticar caminhadas, correr, andar de bicicleta, etc... E com certeza vai encontrar amigos ou fazer novos.", setembro de 2016
JEFF C,,Churrasco no parque,"Otimo lugar , e enorme, tem locais para correr em trilhas de asfalto, trilhas no meio das arvores, da para fazer qualquer tipo de esporte ou passeio, também e ótimo para fazer um churrasco em um dos quiosques que existe no parque sem falar no caldo de cana e agua de coco que tem", novembro de 2015
Carolina C,"Dublin, Irlanda",Faltam opções para as crianças,"O parque é lindo e enorme. Tem pista de caminhada, de bicicleta e de corrida. Tem um lado bonito. Mas dei uma volta no parque e não encontrei um playground para as crianças. Também não encontrei pedalinhos ou aluguel de bicicletas. Não achei a experiência muito positiva. Até", outubro de 2016
Amanda L,"Curitiba, PR",O melhor e mais frequentado da cidade,"O melhor parque para lazer e prática de esporte da cidade. Muitos lugares para estacionar, diversas opções de lanches e comidas.", setembro de 2016
Cris Leal,"Rio de Janeiro, RJ",Gostoso ,Parque Barigui é parque super gostoso para um passeio com a família e para os amantes dos esportes.. , outubro de 2016
Luciane M,,Um ótimo ambiente para passeios em família e esporte,"Um ótimo lugar para passeios em família e para a prática de esportes. Um lugar amplo, agradável. A única desvantagem é que as opções de lanchonetes são poucas, e não tão em conta os valores cobrados. ", junho de 2016
Floripa20132000,"Miami, Flórida",Excelente passeio,"Amamos esse passeio, muito verde, alguns animeis ate Pista para correrá, bike, patinar,,,, etc bem agradavel", agosto de 2016
luiz fernando P,"Garibaldi, RS",Lindo passeio,"Este parque e bastante grande e tive a sorte de visita-lo em um dia ensolarado. Caminhei em volta do lago, podendo observar a natureza local. Vale a pena passar uma tarde de domingo.", outubro de 2016
faspindola,"Brasília, DF",Simplesmente incrivelllll ,"O que é esse parque minha gente? Além de lindo, todas aquelas pessoas com seus filhos e animais de estimação convivendo harmonicamente com a natureza e a criação humana. Não tem como não se encantar. Meu filho brincou com Cachorros dos visitantes e correu atrás dos patos.", julho de 2016
Renata F,,Tem até Jacaré e Capivara,"Amo esse parque! É ótimo para passear, se exercitar e também para o happy hour! Já apareceu jacaré naquele lago, mas foi retirado já...embora diz a lenda que apatrece d vez enquando... rss o que você pode ver com certa frequencia são as capivaras.Muito legal", outubro de 2016
Karolaay B,,Parque lindo,"Parque maravilhoso para quem gosta de praticar uma caminhada, e passear com os amigos. Tem churrasqueira para fazer aquele churrasco no domingo com a familia. Só não recomendo ir em dias ensolarados demais.", setembro de 2016
Fagner R,,Muito lindo,"Achei o parque muito bonito mesmo num dia nublado e frio, toda estrutura do parque bem cuidada, limpo e bem estruturado para quem vai praticar algum esporte.", outubro de 2016
danielzorato,São Paulo,Agradável,O parque é lindo e muito grande. Há ciclovia e pista para corrida. Também estão disponíveis opções para alimentação. Pra mim o melhor parque da cidade., outubro de 2016
Arthur T,"São Paulo, SP",Parque para Curitibanos se exercitarem,Esse parque é como se fosse o Parque do Ibirapuera para os Curitibanos. Tem um lago no meio e as pessoas fazem as atividades em volta do lago. Area muito ampla e com bastante area descampado.  No lago tem um aviso de perigo que existe jacarés mas nunca vi nenhuma movimentação, março de 2016
Daniele C,"Curitiba, PR",O melhor parque da cidade!,"Perfeito para caminhar, fazer um churrasco ou andar de bicicleta. Nos finais de semana fica bem cheio, portanto é sempre bom chegar cedo. Vale a visita! ", novembro de 2015
Raphael T,"São José dos Pinhais, PR",Local de paz e bem estar!,"Estressado? Cansado? ´Vá ao Parque Barigui, dê uma boa caminhada naquela pista de boa qualidade, aprecie o silêncio, ouvindo os pássaros, a natureza. Se tiver tempo e der sorte, aproveite as exposições e feiras do Parque de Exposições. Não deixe de sentar à beira do lago e ver o", outubro de 2016
MarceloBraga2014,"Rio de Janeiro, RJ",Perfeito!,"Muito tranquilo, ar puro, natureza, muito verde. Adorei caminhar e respirar ar puro! Indico para todos conhecerem", agosto de 2016
camilla_emachado,"Fortaleza, CE",Paz e tranquilidade,"Um parque cortado pelas ruas da cidade parece ser barulhento e mal cuidado, mas não o Barigui. É lá onde ficam as famosas capivaras, livres, convivendo (nem tão bem) com os turistas (que nem sempre respeitam o espaço de que elas precisam).  Lá, tem espaço para praticar esportes,", setembro de 2016
penelopecarvalho,"Balneário Camboriú, SC",Ótimo para caminhadas,"O parque é lindo, Conheci ele no Outono e ver aquelas árvores e folhas secas caídas no chão foram um espetáculo dignos de qualquer pintura em tela. O parque realmente é enorme, ótimo para caminhadas e corridas. Nos finais de semana com sol, o povo curitibano vai pra lá, para", julho de 2016
ElmoDias,"Curitiba, PR",EXCELENTE PAISAGEM E NATUREZA - MAL FREQUENTADO NOS FINAIS DE SEMANA,"O Parque Barigui é uma instituição curitibana, e o frequento desde que sequer havia pistas ou pontes (mas o jacaré ancestral estava lá - o víamos há mais de 30 anos perto da torre da velha olaria). Muito frequentado, o parque nas tardes de domingo tornou-se um amontoamento de", outubro de 2016
Pericles O,"Curitiba, PR",Diversao para todos os gostos,"Lugar para caminhadas durante a semana e diversão para toda a familia nos finais de semana, onde regularmente existem eventos programados. Sao varios os espacos que lhe permitem desde fazer um churrasco, um piquinique, um lanche ou mesmo almocar/jantar em restaurante. Pode-se", outubro de 2016
ReginaBaldasari,"Curitiba, PR",Lindo parque,"Fazer sua caminhada, correr, andar de bike, tem 3,bares e lanchonetes, tem pavilhao de exposições e feiras. Tem academia, churrasqueiras e é muito frequentado nos fins de semana.", outubro de 2016
Paulo M,"Erechim, RS",Parque Barigui,"Passeio no Parque Barigui, também conhecido como praia, belo passeio para casais e família, principalmente no final de tarde e fins de semana", dezembro de 2015
Whendryo N,,Passeio,"Poucas cidades grandes possuem um parque tão limpo e organizado quanto esse. Tranquilidade e segurança, ótima pedida para a família.", outubro de 2016
alanlop,"Curitiba, PR",Otimo,O parque e o preferido  dos curitibanos Com um pista de caminhada muito arvorizada O parque sempre recebe atrações de entendimento  Super recomendo um fim de taree por lá., outubro de 2016
zerocorrea,"Curitiba, PR",Passeio com Diversão,"esse é um parque que reuni natureza e diversão, não deixe de ir lá pelo menos uma vez ao mês, encontramos sempre um amigo, e é otimo tanto de dia como a noite, seguro e lindo de se ver", setembro de 2016
Dircelia D,ivai,"""Lindo Parque""","Barigui tem um charme, ele é muito lindo, arborizado, com um lago charmoso, ótimo para caminhar, relaxar, fazer um piquenique.Uma das marcas registradas de Curitiba, impossível deixar de visitar esse parque. Impossível não se render a sua beleza.", agosto de 2016
Marcos S,,O parque,"O parque fica bem localizado e de fácil acesso, tem uma boa área de estacionamento, não tem nada muito exuberante para se ver, porém contrasta com as mansões em suas imediações. Não existe uma preocupação muito grande com manutenção. Outra raridade neste parque é a segurança da", outubro de 2016
WTripsD,,Parque Enorme,"O parque é enorme e tem muitas atrações para se fazer no lugar.  Nesta última viagem, passamos por praticamente todos os parques e o Barigui é bem grandinho.  Além disso, tem vários animais em contato com as pessoas.", outubro de 2016
osneiandre,"Almirante Tamandaré, PR",Coração de Curitiba,"Ambiente maravilhoso, ótimo para fazer caminhadas ou corridas respirando ar puro, alem da presença de muita gente bonita.", setembro de 2016
RudiardVogt,"Teutonia, Rio Grande do Sul, Brazil",Lindo!,"Lindo maravilhoso, incrivel, pena que estava nublado e frio no dia. Mas  a vista do parque vale muito a pena.", abril de 2016
DrSamuelLondrina,"Londrina, PR",ótimo para caminhar pela manha,"Caminhei muitas vezes neste parque pela manha. Trabalhando em Curitiba sempre mantive o habito de caminhar por ali. Local aprazivel, cheio de gente bonita e educada. Muito bem cuidado pelo poder publico. Vale a pena conhecer e frequentar", julho de 2016
Mariliza B,,Parque Barigui,"É o maior e mais movimentado parque de Curitiba.Muito bom para caminhadas,pic-nics,as crianças amam.Tem restaurante, lugar para grandes exposições.", agosto de 2016
Eduardo,,O quintal curitibano,"Um parque pra chamar de seu. Democrático, limpo, verde e movimentado. Ideal para atividades físicas ou relaxamentos.", setembro de 2016
Aluísio A,"São Paulo, SP",Um dos melhores do país!,"O parque consegue uma combinação rara de ser bem localizado, bem equipado e de ter uma vista linda. Uma dica: não deixe de fazer um passeio de bicicleta e, no final, tomar um caldo de cana!", outubro de 2016
André Geiser,"Balneário Camboriú, SC",Ótimo lugar pra relaxar,"Ótimo lugar para relaxar em um domingo de sol,  sentar embaixo das árvores e jogar conversa fora com os amigos, espaço limpo e com estacionamento", outubro de 2016
Alexandre B,"Curitiba, Brazil",Atividades Físicas ,Excelente lugar para caminhadas corridas e atividades ao ar livre. Venha com tempo para admirar a beleza de seus gramados e lagos. Nos finais de semana costuma ser bastante cheio. , outubro de 2016
PAULO CESAR C,,Mais popular da cidade,"É o parque mais popular da cidade onde todos usam para se exercitar , passear se encontrar . Tem um belo lago e fica bem cheio com tempo bom e calor aqui em Curitiba. Tem um centro de exposição Expobarigui onde ocorre as feiras típicas e de variedades .As vezes em algumas datas", julho de 2016
Larissa F,"Curitiba, PR",Lindo!,"Um dos mais frequentados de Curitiba! Há várias atrações pelo parque, incluindo bons restaurantes e um passeio lindo de helicóptero pela cidade. Perfeito para caminhadas e para lazer com família e amigos.", agosto de 2016
Thailla S,,Passeio ao ar livre,"Muito bom para ir com a familia, amigos pra correr ou ate mesmo sentar na grama e bater um bom papo, clima super agradavel.", outubro de 2016
Fabiovs_78,"Curitiba, PR",Ótimo programa de Domingo,"Recomendo o passeio ao parque no domingo, local onde é possível encontrar os Curitibanos brincando, passeando, praticando esportes, etc.", abril de 2016
Cintia R,,Lindo e agradável,"Um belo parque, grande, com boa estrutura, sobra, e tranquilidade. Um dos mais bonitos parques de Curitiba, vale a pena ficar alguns horas.", agosto de 2016
Humberto R,"Curitiba, PR",Era o único parque ate anos 80,"Local cosntruido na administração de Lerner e melhorado com outros prefeitos, porem a ultima administração deixou a desejar na conservação do parque", maio de 2016
Neyd M,"Curitiba, PR",Lindo,"Lugar bonito, cheio de atrações, excelente para fotos artísticas e com a família. Lugar especial para levar as crianças e deixá-las soltas. ", dezembro de 2015
Arnaldo F,"Curitiba, PR",Um Parque maravilhoso,"Ao visitar Curitiba, não deixe de conhecer o Parque Barigui. Você poderá visitar este belíssimo parque comprando o passeio turístico pela Jardineira. Comprando este pacote, conhecerá vários locais prazerosos de Curitiba.", agosto de 2016
Vinicius M,"Rio de Janeiro, RJ",Parque belíssimo ,"Parque bem completo, pista de cooper envolta do lago, vários estacionamentos. Tem um pavilhão de eventos moderno. Bem arborizado e grama bem verdinha e cortada. Vale a visita.", outubro de 2016
EduardoBreda,"Curitiba, PR",O melhor parque de Curitiba,"Moro próximo do Parque Barigui e o utilizo para corridas e caminhadas na sua longa pista (3.300m em volta do lago ou 5.300m se utilizar a passarela sob a avenida). Com 3 pistas paralelas e separadas para caminhada, corrida e ciclismo, nem sempre respeitadas pelos visitantes, um", outubro de 2016
Marceli C,"Curitiba, PR",Lindo.,"Parque lindo, com lago,patos e capivaras. As crianças amaram.Ideal para caminhada ou piquinique. Vale a pena.", outubro de 2016
Mundo em Verde e Amarelo,Santa Catarina,Um lugar especial...,"Apesar de ser uma cidade grande, Curitiba tem inúmeros parques. O Barigui é um dos mais bonitos. Um belo lago, uma enorme área arborizada, pistas para cooper. Lugar ideal para a meditação, prática de exercícios físicos, ou simplesmente um ótimo pique-nique em família!", abril de 2016
vanessasti,"São Paulo, SP",Lindo e super bem conservado,"Lindo o parque, bem cuidado. Perfeito para dias em que tudo que mais queremos é sentar na grama e observar o lago", agosto de 2016
Lucas L,,Programa fitness,"Nos fins de semana pela manhã é cheio de gente correndo, caminhando e se exercitando.  Ambiente bonito e bem cuidado", outubro de 2016
Ronaldo Bini,,parque gigante,"o parque é bem grande, voce pode levar animais, e pode fazer picknick é muito muito indicado para familias.", junho de 2016
TaisFelipe,"Cascavel, PR",Amooo,Lugar maravilhoso p caminhar/ correr/ passear. Tem três pistas ( nem sempre respeitadas) q separam bike/ corrida / caminhada.  Eh possível  alugar bike por lá.  , outubro de 2016
lanaalobo,"Salvador, BA",Capivaras <3,"Ótimo local para um passeio em dias ensolarados. Capivaras ficam soltas pelo parque, são calmas e permitem que os visitantes se aproximem para fotos.", setembro de 2016
alegraciosa,"Curitiba, PR",Adoro ,"Parque é ótimo para caminhar , porém no período da noite tem locais muito escuro onde as luzes estão queimadas .", outubro de 2016
Julio B,"Rio de Janeiro, RJ",Excelente!!,"Um parque fantástico para passear, fazer exercício e ir com a família. Tem diversas áreas distintas para crianças, animais, churrasco. Com certeza um dos melhores parques de Curitiba!", setembro de 2016
Felipe F,"São Paulo, SP",Ótimo ,"Parque bem como estruturado,  com banheiros, bares, churrasqueiras,  área verde enorme. Melhor parque do Brasil ", outubro de 2016
Duane_Cristine,"Curitiba, PR",Parque Barigui,Ótimo lugar para fazer exercícios ao ar livre e passar uma tarde com a família e amigos em um dia ensolarado., maio de 2016
VICTORIA p,,Grande e Perigoso,"O Parque Barigui não falha no quesito beleza e tamanho, e talvez por essas características abrange todos os tipos de públicos,incluindo OS MARGINAIS. Cuidado nunca é demais!!!", outubro de 2016
Luciana,"São Paulo, SP",Ibirapuera de Curitiba,"Este parque é bem grande, digamos que seja o ibirapuera de Curitiba. Tem centro de exposições, estacionamento, pista de bike e corrida, restaurantes, um lago enorme e algumas capivaras. Alugue uma bike elétrica para andar o parque inteiro.", abril de 2016
silmaraschuck,"Curitiba, PR",atividades para todos os gostos,"o parque Barigui é uma ótima opção para os fins de semana, seja para ficar sentado na grana só apreciando o dia ou para fazer esportes. Tem pistas de caminha e para bikes/patins, e para o lado da Rua Cândido Hartmann, há quadras da vôlei de praia e basquete.", junho de 2016
Wellington F,,Lazer,O melhor lugar em Curitiba para quem busca passar uma tarde em um parque com os amigos praticando esportes., agosto de 2016
Thiago d,,Ótimo parque para Curitibanos,"É um excelente parque porém se você é turista e não tem tempo para tudo, existem parques melhores como o Parque Tangua e o Jardim Botânico.", julho de 2016
Pimenta Imóveis,"Belém, PA",Passeios,"Parque ótimo para passear, estar com amigos, pedalar, tomar um Shop,  comer e ver o por do sol. Não deixa de ir.", outubro de 2016
Gabriel S,,"Bonito, grande, bem cuidado.",Este parque proporciona um ótimo passeio de fim de tarde e é um ótimo espaço para pratica de esportes como corrida e ciclismo., setembro de 2016
Frank Bittencourt,"Teresina, PI",Muito bom! ,"Relaxante,  divertido e muito agradável.  Q pena que foi rápido,  mas ficaria o dia todo nesse lugar.  Lindo para fotos,  passear com amigos,  familiares e fazer piquenique.  Gostei muito. ", setembro de 2016
nahiarabressan,"Curitiba, PR",parque nota 10,"Um parque lindo, limpo, cheio de pessoas caminhando, correndo, andando de bicicleta, patins, crianças se divertindo e correndo, casais namorando, capivaras e aves se mostrando pra nós!!! muito bacana conhecer......", outubro de 2016
mjmartha16,"Rio de Janeiro, RJ",Parque Maravilhoso,"Lindo Parque com muito verde. Ótimo para caminhar, fazer atividades físicas, e tirar belas fotos, principalmente das Capivaras e Patos que ficam no Parque.", outubro de 2016
Thamiris L,,Very good,"Esse parque é realmente muito lindo tanto de dia como a noite, vale a pena trazer a familia, cachorro, capivara e jacare hahaha. Tem uma pista para andar de roller, parquinho para as crianças e até um barzinho. ", agosto de 2016
André Dourado,"Ponta Grossa, PR",Local lindo e perfeito dependendo do horário,"Local sem dúvida lindo e perfeito para conhecer, andar e conviver, porém, nos fins de semana, procure ir cedo, pois o estacionamento, apesar de imenso, fica lotado rapidamente.", outubro de 2016
Leisi Fernanda M,,Belo lugar,"É um parque lindo, com ótimo lugar para caminhar, levar crianças, sentar para conversar com amigos, passar a tarde...as vezes tem exposições...tem um estacionamento amplo... é lindo. Vale a visita.", novembro de 2015
Márcio C,"Curitiba, PR",Um dos parques mais famosos da cidade ,Um dos parques mais visitados de Curitiba. Famoso por seu lago e bom  para se caminhar correr ou andar de bicicleta. , outubro de 2016
Anderson L,,muito bom,"otimo lugar pra se  fazer ativades fisicas ao ar livre, e tambem passeios com a familia, namorados nos fins de semanas sempre esta lotado vale a pena passea la.", agosto de 2016
Cicero V,"Curitiba, PR",Manhãs de sábado ,"As manhãs de sábado são ideais para uma corrida e se divertir com as crianças. A vibe é ótima, e não é tão cheio. ", setembro de 2016
Victor_yamagami,"Curitiba, PR",Bom para relaxar e praticar exercícios,"Muito frequentado nos fins de semana por praticantes de caminhada, corrida e ciclismo que gostam de um cenário mais natural. O parque conta com uma pista que contorna o lago permitindo a prática desses esportes. Ótimo também para quem quer simplesmente relaxar ao ar livre.", setembro de 2016
Luiz Lipiec,"Curitiba, PR",Espaço Público para Lazer.,"1.4 milhões de m², inteiramente Gratuito para diversas atividades puramente de lazer. Tem um bar com DECK com preços acessíveis e um cardápio variado, sorveteria, parque de exposições, áreas com churrasqueiras, espaço para aeromodelismo e outros.", outubro de 2016
JeffaoACN,"Jersey City, New Jersey",Excelente Parque ! ótimo para uma tarde de descanso,"Resolvi passear com a minha esposa pelo parque com o violão nas costas, onde encontrei um local calmo e tranquilo que pude apreciar a vista do lago e passar algumas horas deitado embaixo de uma árvore.  Sensação de segurança e tranquilidade que se vê em poucos lugares. Recomendo", junho de 2016
Cassio C,"Santos, SP",O melhor!,"Se dúvidas o melhor parque da cidade, sua extensão com mais de 10 km, vale alugar uma bicicleta e aproveitar os arredores do parque e o grande lago, fazer uma boa caminhada e exercícios.", julho de 2016
Patrício A,,Barigui,"Praça mega grande, com parquinho para crianças, otima para fazer caminhada, possui banheiro no local", novembro de 2015
Guilherme L,,ótimo para churrasco,"Um excelente parque para fazer churrasco, piquenique e passar o dia com amigos e família. Há muito espaço para jogar bola, fazer caminha\corrida, andar de bike, roler... Existe várias churrasqueiras gratuitas, mas é preciso chegar cedo para pegar uma. Fins de semana e feriados", outubro de 2016
Renato P,"Curitiba, PR",O melhor parque da cidade,"O melhor parque da cidade!! Para passear, para correr ou para encontrar amigos.acessivel de qualquer lugar da cidade. ", outubro de 2016
Cláudio Henriqu... H,,Muito bem arborizado,"Parque diferente, onde não há portões e nem grades. Muito gramado, pista de corrida, caminhada e bicicleta em torno de 4km. Poucos locais para estacionar e fim de semana lotado", outubro de 2016
Brian B,,Minha segunda casa. Quase quintal.,"Melhor, maior e mais tradicional parque de Curitiba. Possuí amplo espaço para lazer, sempre limpo e bem cuidado.", outubro de 2016
Junior M,,Barigui,"O parque Barigui é o maior parque da Cidade, dentro dele pode se encontra um dos restaurantes mais luxuoso da cidade o Maggiore eventos, mas a atração do parque mesmo são as capivaras, caminhando se consegue ver muitas.", outubro de 2016
IRENE S,,Imperdível,"Enorme lindo, cheio de bichinhos os quais andam soltos pelo parque, no dia da minha visita era domingo o dia estava lindo e parque estava cheio de curitibanos, fazendo piquenique, caminhadas e namorando, o parque tem uma vista linda da cidade. Recomendo", setembro de 2016
Liliane,"Natal, RN",Adorável ,"Fui no ônibus da Linha Turismo e desci no Parque Barigui. Era uma quinta à tarde um pouco após o horário de almoço, logo não tinha tanta gente. Como vários parques de Curitiba, é muito arborizado e com lagos, pontes... pista longa e larga pra caminhada e pedalar. Há uma pequena", outubro de 2016
Débora C,,Excelente para todo tipo de atividade,"No parque barigui é possível encontrar pessoas andando de long board, skate, bicicleta, jogando futebol, vôlei, ou simplesmente deitadas na grama aproveitando o dia. É uma ótima atividade para quem gosta de estar sempre na natureza, mas não tão imerso por conta do perigo. Super", setembro de 2016
RobertoEFarias,"Curitiba, PR",Parque lindo em Curitiba. Pra toda família!,"O Parque Barigui em Curitiba é uma ótima opção pra quem quer passear com a família, amigos, companheiro... Lugar perfeito pra correr, caminhar, pedalar ou simplesmente ficar parado perto de uma árvore ou no gramado. Perfeito para um dia de sol!", setembro de 2016
