author_name,author_from,comment_title,comment_body,comment_date
jehkrdoso,"Ijuí, RS",Super agradável!,"Uma graciosa surpresa! Esse é o parque dos moradores mesmo. Super gostoso de ficar, ele é enorme, e cada lado dele parece que você esta em um parque diferente do outro. Muito agradável! Confesso que não dava vontade de ir embora!", abril de 2019
600 Hermes,"Curitiba, PR","O 1º PARQUE DE CURITIBA,  É O MAIS BONITO   E O MELHOR  PARA   FAZER SUA CAMINHA MATINAL OU NO ENTARDECER.","O Parque Barigui é hoje uma Atração para a cidade de Curitiba. Lá tem tudo: Restaurante, o Lago muito bonito, tem Expaço para  EXPOSIÇÕES, TEM ESTACIONAMENTO, TEM AQUELE CÔCO E A CANA DE AÇUCAR GELADO.", março de 2020
Rodrigo Ramos,"Porto Alegre, RS",Visita à parque,Fomos ao parque para curtir um pouco a natureza e relaxar a beira do lago. Lugar gostoso para se tomar um chimarrão ou fazer um piquenique., março de 2020
Ana Paula C,"Benedito Novo, SC",Parque familiar ,"Um lugar lindo para conhecer com toda família, inclusive com pets.  Espaço para correr, patinar, andar de bike, de skate,etc. Até levar sua toalha e fazer um picnic. Lugar lindo e conservado.", março de 2020
Nilza P,"Vargem Grande do Sul, São Paulo, Brazil",Lugar lindo!,Vale a pena conhecer esse parque. Maravilhoso.E o mais legal é que fica próximo ao Park Shopping Barigui., fevereiro de 2020
cintia s,,Lindo parque,"Pra quem gosta de pedalar e ao mesmo tempo apreciar uma bela paisagem, sem dúvidas esse parque é uma excelente opção. Muito espaço para caminhada e é possível até fazer um piquenique. O por do sol tem a melhor vista.", março de 2020
lpereira111953,"Curitiba, PR",Visita sábado de manhã,Melhores e dia para conhecer este parque. Sábado de verão com muito sol. Todos marcam encontro no Parque Barigui. Que seja para uma caminhada e depois uma cerveja no bar do trapiche., setembro de 2019
Clovis A Manfio,"Barueri, SP",O parque que é a cara de Curitiba,"Muito bem cuidado, limpo, sinalizado e seguro. Rotas para bicicleta e para caminhadas separadas para segurança dos usuários. Aproveite a parada do onibus turistico e visite também o Museu do Automóvel", fevereiro de 2020
Vanessa C,"Rio de Janeiro, RJ",Perfeito para um domingo!,"Quer fazer uma caminhada, corrida ou andar de bike? Lá é o lugar. Dá pra alugar bike e patinete lá na frente. Pagamos 29 reais por quase 1h de bike. Achei válido! Além disso, na frente do Parque, está localizado o Museu de Automóveis.  ", fevereiro de 2020
@luna.tiffany.pet,"São Paulo, SP","O melhor parque de Curitiba, para quem tem PET!","Com 1,4 milhões de metros quadrados de área, é um dos maiores parques da cidade. Não são apenas os moradores da cidade e os turistas que procuram descanso no parque. Preás, socós, garças brancas, gambás, tico-ticos, sabiás e dezenas de outros animais nativos fazem do Barigüi a", fevereiro de 2020
Nathalia A,,Ótimo para atividades ao ar livre,"Lugar que te permite estar em contato com a natureza, capivaras que não se incomodam com a presença das pessoas, patos, ganços há aluguel de bicicletas e patinetes disponíveis. Vá de tênis, calça e use repelente.", fevereiro de 2020
eulers56,"Recife, Brasil",Ótimo lugar para atividades ao ar livre,"Ótimo lugar, limpo e organizado, ideal para fazer atividades ao ar livre, correr, andar de bicicleta, ou apenas fazer um passeio.", setembro de 2019
Ppatriciart,"Vitória, ES",Grande,"Parque grande, bonito, bem cuidado. Fica em frente ao shopping Barigui. Tem um lago com capivaras que são um show a parte.", maio de 2019
Leila K,"São Bernardo do Campo, SP",Um dos melhores parques de Curitiba !,"Parque amplo com espaço para caminhadas e piqueniques.  As capivaras dão um show a parte, andando pelos jardins e nem se incomodando com as pessoas.  As pistas ao redor do lago são muito boas.", fevereiro de 2020
Anna Barbara M,"Itajaí, SC",Espaço amplo e capivaras,"Ótimo parque para caminhar, correr, andar de bicicleta ou patinete. As capivaras são um show a parte.", fevereiro de 2020
Ary Jose Freitas,,Passeio com emoções,"Já na chegada um gigante estacionamento para automóveis, motos e bikes. Um lago limpo e com a moradia de um jacaré. Pistas para andar e correr, muitas árvores e plantas arborizando o ambiente, restaurantes e churrasqueiras para as famílias. Dá para passar o dia ali. Aconchegante!", fevereiro de 2020
Tleis,Curitiba,Corrida pela manhã,"Ótimo lugar para descansar, encontrar amigos, tomar um sol, brincar com os Animais de estimação, tomar um chopp, enfim, um lugar para quem vem a Curitiba não pode deixar de visitá-lo.", fevereiro de 2020
EloizaMC,,Belíssimo parque!,"Um dos parques mais bonitos de Curitiba. Uma delícia para fazer uma boa caminhada, ou simplesmente admirar a natureza, as capivaras tomando um sol ( quando aparece por aqui) rsrs. Lindo passeio!", fevereiro de 2020
Nelsonlage,"Nova Iguaçu, RJ",Passeio em família,"Um dos melhores parques de Curitiba. Excelente para caminhadas, com quiosques para lanches e bebidas.", janeiro de 2020
Graciete P,"Curitiba, PR",Meu parque preferido!!,"Pelo menos 3 vezes na semana vou ao Parque Barigui para correr ou caminhar. Vou a eventos no Centro de Exposições, tomar água de côco, passear com as amigas, fazer piquenique. Construi uma casa no parque e morei por 10 anos. Amo esse parque.", janeiro de 2020
Lisi Rossa,"Correia Pinto, SC",Ótimo para relaxar,"Fomos logo após o almoço, lugar tranquilo, sossegado, ótimo para fazer caminhadas, andar de bike ou patinete, ler um livro ou fazer um piquenique com as crianças. Tínhamos pouco tempo para ficar no parque e logo o tempo fechou para chuva, então não deu para aproveitar muito, mas", janeiro de 2020
Eliane D,,Noite agradável com boa companhia ✨✨,O shopping Barigui é na minha opinião o melhor shopping de Curitiba...sempre faço meus encontros com amigos e famíliar lá...ultil ao agradável ♥️😋💞👗👘👜, dezembro de 2019
Daniel Lima,"Curitiba, PR",Ar Puro.,"Lazer, tranquilidade, muitaaaa área verde, verdadeiro paraiso, não tem como visitar Curitba e não passar por aqui.", janeiro de 2020
Thay Duarte,"Caiobá, PR",Demais,Me surpreendi com esse parque. Muito grande e com uma estrutura muito diferente do usual. Adorei ver as capivaras, maio de 2019
Cátia Pereira,"Cabo Frio, RJ",Um parque muito agradável ,"Lindo parque, bem cuidado, proporciona ótimos momentos de contato com a natureza, tem um restaurante do lago com uma vista deliciosa e se está com tempo de uma volta completa de skate elétrico disponível por todo o parque  Super agradável ", fevereiro de 2020
Andréa S,,Melhor parque de Curitiba,"O parque é grande, muito bem cuidado, com pista para ciclista separada da do pedestre, com pássaros, capivara, peixe.  Tem uma loja que aluga bicicletas, o que recomendo caso vc não possa levar a sua.  Alugamos uma com cadeirinha para nossa filha. Aconselho percorrer todo o", fevereiro de 2020
Leandro kawase,"Curitiba, PR",Parque bacana !,"Parque muito  bonito ! Otima energia ! Bastante opções  no parque , tudo para tornar um passeio super bacana ao ar livre seja com os amigos pu aquela companhia especial ! Recomendo!", fevereiro de 2020
tbaruffi,"Jaraguá do Sul, SC",Perfeito para caminhar,Eh meu parque preferido em Curitiba. Excelente para prática de atividades físicas e com outras opções de lazer!!! Muito bom!!!, fevereiro de 2019
Reginaldo L,"Belo Horizonte, MG",Ótimo para caminhada,Um outro bom parque de Curitiba. O local possui pista demarcada para ciclista e para quem quer caminhar bastante arborizado e opções de locar bicicletas e patinetes. Possui um grande estacionamento gratuito no parque.  Recomendo., janeiro de 2020
Igor A,"Salvador, BA",Muito bom,"Local muito agradável, limpo, arborizado, conservado. Vale a pena a visita com a família. Possui local para lanchar.", janeiro de 2020
Gilberto M,"Recife, PE",lindo parque,"Um parque muito bonito, ótimo para a família, bem amplo, é possível patinar , andar de bicicleta e se divertir bastante . bem cuidado, e bem arborizado. ", julho de 2019
Cristina G,"Sorocaba, SP",Outro belo cartão postal de Curitiba.,"Lindo! Enorme. Prepare- se para uma super caminhada. Vale muito uma visita sem pressa. Possui um belo lago. Local de caminhada, esportes. Possui restaurante, pavilhão de exposições e amplo estacionamento. Recomendamos.", dezembro de 2019
Marcia S,"Salvador, BA",Parque Barigui,"Parque lindo d+! Os jardins são incríveis, fiquei encantada com as cores, as flores. A cachoeira é um linda", dezembro de 2019
gabrieller0cha,,"Excelente parque para passear, caminhar, correr, andar de bicicleta ou patins ou patinete... td ao ar livre e gratuito.","Parque ao ar livre gratuito, lindo, mto bem conservado, com estacionamento tb gratuito. Único problema: donos de cães que os levam para passear ainda deixam no local as fezes dos animais. Infelizmente encontramos várias ao longo do percurso... atenção aí pessoal, levou o totó p", janeiro de 2020
Lara Oliveira,"Pelotas, RS",Legal,"É interessante para passar uma tarde, mas ao chegar me decepcionei um pouco. O que é legal são as capivaras, mas em geral o parque não tem nada de muito diferente além de grama e água. É bom para relaxar, mas acho mais interessante o parque Tanguá por exemplo.", janeiro de 2020
Sergio B,"Curitiba, PR",Parques,"O Parque Barigui é um dos muitos parques de Curitiba. É o maior e um dos mais bonitos, juntamente com o Parque Tanguá, com muitas caminhadas, um grande lago e uma vista do perfil da cidade.  Vale a pena.  No final de semana é muito movimentado.", dezembro de 2019
Gisele Lira Tourinho,"Rio de Janeiro, RJ",Delícia de Parque!!!,"Fomos meu marido e Eu, em um domingo de verão (Janeiro de 2020) e o clima estava maravilhoso. Alugamos um patinete elétrico, super baratinho (pagamos 15 reais em cada, em meia hora) e foi muito legal andar pelo parque de patinete. O parque é super agradável, tinha bastante casal", janeiro de 2020
Thatiane Pellissier,"Londrina, PR",Excelente para passar o dia ,"Parque muito gostoso e movimentado. Seja para passear com a família, com o pet... Há patinetes para locar, opções para comer e beber (carrinhos de doce, caldo de cana etc). Um bom lugar para fazer um piquenique.", janeiro de 2020
Raili,"Maringá, PR",Perfeito!!,"Pensei que o parque era pequeno, mas não se engane, o parque é gigantesco. Não consegui andar tudo, realmente da para se perder dentro do parque. Mas é lindo, muito bem arborizado, limpo, com várias pontes, rios, lagos, quadras para prática de esportes. Para quem vai de carro", janeiro de 2020
Compass623141,"Rio de Janeiro, RJ",Beleza,"Parque lindo, perfeito para um piquenique, passeio com a família, local seguros, natureza abundante, simplesmente lindo", dezembro de 2019
ROBERTO P,,Muito bonito,"Lugar muito bonito e tranquilo, ótimo para relaxar e realizar caminhadas, próximo ao Shopping, gostei.", janeiro de 2020
Otton Rogerio Lima,"Curitiba, PR",Cuidando da saúde,"Um lugar diferenciado entre os varios parques oferecidos na cidade de Curitiba, com muito verde e qualidade no ar, pratica de diversos esportes e lazer. Ideal para toda a familia. Durante o ano todo sempre uma qualidade de vida.", janeiro de 2020
Gilberto P,"Curitiba, PR",Amplo e agradável mas o lago precisa cuidados,"Local muito bom para passear com a criançada, amplos locais gramados e muitas árvores para descansar à sombra. Os estacionamentos são amplos o que ajuda a receber muitas pessoas.o porém fica pelo lago, que merece ser mais bem cuidado e precisa retirar o excesso de cocô de", janeiro de 2020
Viajar,Bahia,Reserve um tempinho para aproveitar,Reserve um tempinho para andar ou pedalar no parque. Tem bikes e patinetes lá pelo App. Parque tem animais livres., janeiro de 2020
Ivana Vizoni,"Londrina, PR",Desconectar,Lugar pra relaxar. Curtir a natureza. Praticar esportes. Fazer piquenique. Até um churrasquinho combina. Excelente para passar o dia com a família e amigos. , janeiro de 2020
Caroline Mattar Assad,"Curitiba, PR",O melhor parque da cidade,"O Parque é uma delícia, frequentado por bastante gente. Pistas distintas para caminhar, correr e andar de bicicleta. Além de espaço pra exercícios físicos, existe muita área verde, churrasqueira e ambientes para esticar uma toalha e ficar de bobeira com os amigos e família. O", janeiro de 2020
Luiz Gomes,"Rio das Ostras, RJ",Relax...,"Grande, bonito, agradável! É mais um reduto de paz, tranquilidade... É ótimo para lazer em família, com espaço para churrasqueiras, pistas para caminhada, corrida e ciclismo, conta ainda com o serviço de aluguéis de patinetes elétricos! Tudo de bom.", dezembro de 2019
lilianpraia,"Curitiba, PR",Lindo parque,"Lindo parque,  grande  área verde bem cuidada.  Sugestão  seria excelente um local para lanches, como uma sorveteria de boa qualidade,uma cafeteria  com café  da manhã  ou  uma lanchonete de qualidade", janeiro de 2020
Ananda Gurgel,"São Paulo, SP",Ótimo parque em Curitiba,"Parque muito bonito, limpo, bem plano e com bastante área verde.   Logo na entrada do parque você pode alugar bicicletas para passar umas horas pedalando. Em algumas partes ao redor do parque tem estacionamento. Existe banheiros mas tem que pagar para o uso.  Ao redor do lago", janeiro de 2020
Monica Regina B,"Rio de Janeiro, RJ",Para a família inteira,"Parque com muitas opções de atividades: caminhadas, brincar com cachorros, andar de bicicleta ou patinete, jogar bola, frescobol, descansar na grama... diversão para todos os gostos.  Há opções de banheiros limpos a 2 reais.  Há vendas de água, sorvete, água de coco, caldo de", dezembro de 2019
André Ortolani,"São Paulo, SP","Belíssimo, mas pouca infraestrutura","O parque em si é belíssimo. Contudo, levando em conta que visitamos no dia 30/12/19, estranho a falta de infraestrutura e suporte no parque. Difícil ficar com crianças pequenas por muito tempo", dezembro de 2019
Aline Rios,"Vitória, ES",Melhor parque,"Na minha opinião é o melhor parque de Curitiba! Vemos capivaras em todo o parque, os restaurantes são ótimos e em volta do restaurante ficam os patos e peixes grandes... quando jogamos pão para eles é muito divertido!", janeiro de 2020
BabiSmi,"Curitiba, PR",Programa fitness,"Por ser plano na sua maior extensão, é uma ótima opção de parque para praticar exercícios, pedalar e patinar.", fevereiro de 2019
naotemho,"Paraisópolis, MG",Parque mais tradicional da capital paranaense,"O parque é um dos mais antigos de Curitiba. Possui trilhas para caminhada, um amplo estacionamento gratuito e um enorme lago que cobre grande parte do local. É preciso tomar algum cuidado com animais de estimação pois no lago existe um jacaré (não é lenda!). Nos finais de semana", dezembro de 2019
Caroline Mariano,"Rio de Janeiro, RJ",bom ,excelente lugar para atividades ao ar livre ...excelente para o início da manhã e fim de tarde ..ótimo para picnic, dezembro de 2019
Rodrigo F,"Foz do Iguaçu, PR",Sempre uma ótima pedida,Paisagem linda e toda estrutura necessária para se exercitar ou só para passar o tempo. Excelente também para quem tem crianças: não faltam espaços para brincar., dezembro de 2019
NEANDER PEREIRA,"Curitiba, PR",Parque belo e seguro em Curitiba.,"O Parque Barigui é um excelente lugar para se fazer caminhadas, andar de bicicleta, correr, ou simplesmente admirar a natureza.  Lá você vai ver gansos, capivaras,  peixes, abelhas (sim, há caixas de diversas espécies de abelhas sem ferrão) e outros animais.  Há uma sede da", dezembro de 2019
CleberMello,"Rio de Janeiro, RJ",O parque dos curitibanos,"Um parque muito bem cuidado, com ciclovias, pista de corrida e uma bonita paisagem. É onde o curitibano vai para se exercitar. Na minha opinião é um parque mais para os locais. De qualquer forma, se você estiver com tempo, valo conhcer.", dezembro de 2019
Flavia S,"Gramado, RS",Passeio,"Lugar lindo, limpo, bem arborizado, possui restaurante, cafeteria, sorveteria, amei a organização do espaço, o parque transmite uma paz, ótimo para curtir em família com amigos.", dezembro de 2019
Fernando Soares,"Cubatão, SP",Ótimo para caminhadas e exercícios,Parque destinado à atividades físicas com direito há usufruir de belas paisagens e ao contato com a natureza., dezembro de 2019
Alfaides C,,Ciclovia,"A ciclovia do Barigui é o primeiro anel interno de três anéis, ciclista não tem acesso a este anel sem passar por cima da grama, após a chuva fica pior em alguns locais com água.", dezembro de 2019
Pedro,,Ótimo para atividades ao ar livre,"O parque barigui se destaca por suas amplas pistas de corrida e extensa área verde, sendo ideal para passear com animais de estimação ou levar os filhos para terem contato com a natureza.  As pistas de corrida possuem: 3,3km (amarela) e a outra cerca de 2,4km (azul). São", dezembro de 2019
alessiacolombo,"São Paulo, SP",Ameiiiii,Lugar lindo que recomendo todos a visitarem! Amei o pavilhão de eventos a beleza do local e a limpeza! , novembro de 2019
Thais Tavares,"Rio de Janeiro, RJ",Passeio para todo o dia,O Parque é gigante e merece uma boa cainhada ou pratica de exercício. Excelente para passar o dia com a afamilia e crianças. Não há muitas opções de almoço e poderiam investir mais nesta estrutura., novembro de 2019
Jeniffer Paolillo,"Guarujá, SP",OPÇÃO PARA PRATICAR EXERCÍCIOS,"Para quem for com intuito de passear, tomar um sorvete ou encontrar feirinhas de artesanato, esqueçam, é um parque aberto e nada mais, nem um sorvete você encontra, ficamos pouco tempo pq não tinhamos mais opções.", agosto de 2019
LiviaMayer,"Rio de Janeiro, RJ",Falta um bom parquinho,"A área é linda , ver as capivaras foi muito legal. Porém senti falta de um parquinho como o do passeio público. A maioria dos parquinhos em Curitiba conta somente com três brinquedos (um escorregador, uma gangorra e um trepa trepa). Não sei se é viável mas um passeio de", novembro de 2019
brunopitlo,"Curitiba, PR",otimo,"parque na entrada da cidade, muito gosto de ir matar um tempo, tomar seu bom vinho, dar uma relaxada", junho de 2019
Ney Vieira,"Curitiba, PR","Show ! É uma das ""praias"" do curtibano","Se tem um lugar que eu não deixo de curtir toda semana..., esse é o lugar!  Pra caminhar, correr, pra tomar sol , ler e ficar em silêncio à sombra, ver gente bonita, bike e patinete de aluguel, fazer pik-nick, churrasco, barzinho, restaurante (Maggiore) , apreciar a natureza, o", novembro de 2019
Mônica Mello,"Montevidéu, Uruguai",LAGO MARAVILHOSO,Esse parque é especial. E tem um bar no meio do lago. Tudo em Curitiba é muito bem cuidado e lindo!!, novembro de 2019
Leslie B,"Passo Fundo, RS",Parque lindo ,"Parque lindo para passear!! Após um treino ao ar livre, com uma água de Coco para hidratar, é maravilhoso!! ", novembro de 2019
Marcelo,"Calgary, Canadá","Parque Barigui, Um dos belos Parques de Curitiba ","Sem dúvida o melhor parque para se exercitar e passear com cachorros, local para caminhada, corrida, skate, patins, bike, bons locais para estacionar, também tem restaurantes. ", novembro de 2019
Curitiba pelo Mundo,"Curitiba, PR","Ar puro, povo bonito e muita disposição.","O parque continua sendo a opção do curitibano para passeios ao ar livre, correr, andar de bike, skate, patins, jogar vôlei ou mesmo só pra  andar com a família! Possui até uma academia pública da prefeitura! Lugar eclético, onde você observa de tudo, os bandos de capivaras", novembro de 2019
Beta Rodrigues,"Curitiba, PR",Meu Jardim,"Por ficar próximo da minha casa costumo chamá-lo de “meu jardim”. Faço ali as minhas caminhadas matinais. Amo o parque Barigui. Lugar para relaxar, ler um livro, tomar chimarrão, fazer ioga, praticar Tai Chi, tomar uma cerveja em um bar/restaurante e até passar um réveillon bem", novembro de 2019
David Flagger,"São Paulo, SP",Um parque maravilhoso,"Toda vez em que viajo para Curitiba, minha visita neste parque é certa. É um parque público, aberto 24h, rodeado por casas padrão A e B, está entre os parques mais procurados pelos moradores nos dias em que o sol decide aparece. O parque é cortado pelo Rio Barigui e tem um lago", julho de 2019
Andressa N,,Para mim o melhor!,"O parque é lindo! Tem muitas áreas verdes, locais para sentar e aproveitar a vista. Está perto de shopping e é possível passear por ele de patinete ou bicicleta. O graaande diferencial são as capivaras. Pensa num bichinho lindo e simpático. Não saia de Curitiba sem vê-las! ", novembro de 2019
Ariane Santos,"Florianópolis, SC",Um dos melhores parques da cidade,"O parque é lindo e ótimo para passear com as crianças, para fazer atividade física ou apenas para ir conversar mesmo. ", abril de 2019
Fred Baião,"Belo Horizonte, MG",Parque das capivaras,"O Barigui é um parque bastante frequentado pelos moradores, ao contrário do Jardim Botânico. Tem áreas de churrasco, posta de caminhada e corrida e muitas áreas de estacionamento.", novembro de 2019
Thiffany Soares,"Ilhabela, SP",Bom para praticar esportes,"Lugar muito bonito e limpo. Com bastante espaço para fazer uma caminhada, olhar os patos, levar cachorro... bater uma bolinha... fazer de tudo um pouco.", dezembro de 2018
Deni P,,Contemplação!,"Um parque para contemplar, caminhar, fazer atividades físicas. Um local maravilhoso, com muito verde e muita água. ", novembro de 2019
giba2016,"Registro, Brasil",Parque gostoso e muito bonito.,"O Parque Barigui é muito bonito, bem cuidado, com pista para caminhada, corrida e bike. Bem arborizado, tem estacionamentos, vários trailers de caldo de cana, aluguel de bikes,  restaurante, feira de doação de animais (1 vez por mês). Vale muito a pena.", outubro de 2019
Francisco F,"Curitiba, Brazil","Lugar muito bonito, inclusive com bons restaurantes e bares","Especial para fazer caminhada, exercícios de modo geral, com duas pistas para caminhadas mais longas ou curtas.", outubro de 2019
Eduardo S.,,Quem gosta de exercício,"Parque bem cuidado , bem grande . Para quem vai preparado para fazer exercícios , possue uma infra estrutura boa para os praticantes de esportes", julho de 2019
Mag E,"Niterói, RJ",Bem cuidado,"Tudo bem cuidado, por isso  digo sempre, Curitiba é outro País, ruas limpas, pessoas educadas, embora um pouco reservadas, mas prestativas. ", outubro de 2019
Juninho C,"Curitiba, PR",Ótimo para correr,"Atualmente o melhor parque para se correr. Porém o local está precisando de uma manutenção mais condizente com a realidade do parque. Está dando enchente direto lá e acumula lama nas pistas e dá mau cheiro. Prefeitura, vamos dar uma melhorada por lá ????", setembro de 2019
Allyson C. Oliveira,"Curitiba, PR",O melhor parque ,"O melhor parque de Curitiba sem dúvida é Barigui. Tem estacionamento gratuito, churrasqueira gratuita, lago, rios e muita área verde. Sem falar na vista e bons restaurantes próximos . Parada obrigatória de Curitiba pra quem gosta de parque.", outubro de 2019
Rodrigo Lupareli,"Rio de Janeiro, RJ",Respirar Ar Puro.,"Como todo parque possui ciclovias, pista de corridas e caminhada, tem uma longa extensão e serviço de Patinete e Bicicleta elétrica para alugar.", outubro de 2019
mariaade50,"Curitiba, PR",Lindoo,"Parque Barigui  é um dos muitos parques que proliferam em Curitiba. A natureza se faz presente com muitas árvores, lago,o rio que dá nome ao Parque. Tem tb  pistas de corrida  e caminhada, academia ao ar livre, pontes, pavilhão  de exposições, passeio de helicóptero,", outubro de 2019
Nanda_Rios,,Caminhar ou andar de bike?,"Contato com a natureza, no qual você pode alugar uma bike na entrada e aproveitar o máximo que puder.", setembro de 2019
Paula,"Florianópolis, SC",Apaixonante!,"Lugar muito lindo!! Otimo para caminhar de bike, bater fotos e apreciar a fauna e a flora. Nunca tinha visto capivaras tao de perto!! E muito gostoso ir pra la, fazer piquenique com os amigos! ", setembro de 2019
Rodrigo J,"São Caetano do Sul, SP",O Melhor Parque da Cidade,"Vale a pena passear por esses quase 8km de muito verde e ar puro. O parque mais cheio, porém o mais gostoso da cidade. Vale a visita", outubro de 2019
Tenice S,"Curitiba, PR",Adorável em qualquer época ,"Passear no parque, caminhar, ver o por do sol no lago (um dos mais bonitos da cidade) é  sempre adorável. Excelente para fotografar e fazer pique nique. Para quem gosta de andar de bike, skate, patinete o lugar é  perfeito e sempre movimentado.", outubro de 2019
Luciana B,,Muito lindo!,"Lindíssimo o parque! Recomendo a visita ao local, que é bem espaçoso. Tem estacionamento gratuito e é aberto a qualquer pessoa. ", setembro de 2019
Kaori Tr.,,"Amplitude, natureza e espaços!","À minha vista, vejo lagoas, várias aves, araucárias, várias árvores, casas com arquiteturas típicas, pessoas aproveitando o espaço amplo que existe, brincando, andando de bicicleta, correndo, aproveitando o momento. E então, resolvo ter meu almoço no restaurante que existe lá", julho de 2019
Viviane V,,Parque Belíssimo! ,"Acho que esse é o maior parque de Curitiba e é ótimo para quem quer caminhar, correr, andar de bicicleta, sentar no sol tudo isso em meio a um lugar com muito verde, com água do rio e na cia das capivaras (que no dia da nossa visita não apareceram). Lugar excelente para quem", setembro de 2019
engftmarques,"Rio de Janeiro, RJ",Parque mais vivo de Curitiba,"Neste parque encontra-se vida por ser o único em que se pode ver a integração do homem com a natureza. Há bares, pessoas se exercitando, andando de bicicleta e patins. Bom lugar para atividades de lazer.", setembro de 2019
