author_name,author_from,comment_title,comment_body,comment_date
Philipe,"Vila Velha, ES",Tarde com amigos,Lugar muito bom para se passar uma tarde divertida e gostosa com amigos e familia. Gosto muito de ir a esse parque., julho de 2015
itadrica,"Presidente Figueiredo, AM",Muito bonito,"Assim como as dezenas de parques em Curitiba, este é muito bonito, alguns bares na beira do lago lembram uma praia.", janeiro de 2016
camzac,"Sorocaba, SP",Curitiba declaro amor!,"Como todos os lugares que passei em Curitiba, sempre trazendo muita paz, excelentes para estar em contato com a natureza.", agosto de 2015
Viirochaa,,Slacklife,"Parque mais afastado, muito bonito e bem grande. Otimo pra quem gosta de praticar esportes ou ficar sentado nas margens do lago que tem por la. Possui um estacionamento de bem facil acesso. Vale a Pena tirar um dia pra conhecer, vc pode encontrar muita coisa legal por la.", março de 2016
Carolina M,,Passeio,"Lugar bom para quem quer fazer exercícios, ou apenas passear com a família, a paisagem é linda e sempre há eventos lá que chamam a atenção do público.", junho de 2015
facilricardo,"Rio de Janeiro, RJ",lindo,Não tenho palavras para descrever o que eu vi naquele parque verdadeiramente curitiba esta de parabens, maio de 2016
Ricardo B,"Novo Hamburgo, RS",Excelente parque para prática de espirtes,"Adoramos esses parque. Repleto de árvores, local amplo, com lago repleto de gansos e aves. Há centenas de vagas para estacionamento. Além disso, o local é perfeito para caminhadas, corridas e para ciclistas, havendo indicações no solo para cada tipo de atividade. Também há", abril de 2016
alineparapsi,"Joinville, SC",Parque para passeio,"Melhor parque de Curitiba. Otimo para passar varias horas, ir com amigos, sentar embaixo de uma arvore, ler um livro, ou simplesmente caminhar, pedalar. Muita area verde. Lindo!", abril de 2016
roniepetterson,"Mafra, SC",Melhor parque do Brasil,"Lindo parque, ótimo para fazer exercicios e tambem para admirar um belo por do sol. Para quem gosta de fazer piqueniques é um lugar incrivel", janeiro de 2016
Alessandro N,,melhor parque de curitiba,"melhor parque de Curitiba,super indico ,pra qualquer um que vim aqui ,tem que passar aqui,sempre lindo e cheio de verde!", abril de 2016
rpaquer,"Cuiabá, MT",Grande e agradável,"É um dos parques mais bonitos que já fui. Muito organizado, com pistas distintas para cada modalidade: bike, caminhada, corrida. Gostei muito!", março de 2016
774gloria,"São Paulo, SP",um sonho,"lindo parque, com um lago perfeito, restaurantes, salas de reuniões, pista de caminhada e de bike. muitos animais lindos como as capivaras", maio de 2016
FernandoGiatti,"Campinas, SP",Muito lindo,"Lugar para caminhada, passeio com crianças, atividade ao ar livre, conhecer pessoas e até passeio de helicoptero.", abril de 2016
maraCuritiba_PR,"Curitiba, PR",Muito lindo!!,"O tao famoso Parque Barigui é muito lindo e muito bem cuidado, ponto de encontro da galera nos domingos o local bomba de tanta gente! Dias de semana é mais tranquilo. Um bom lugar para ver gente, passear com o cãozinho, brincar com os filhos, namorar, arejar a cabeça. Tem umas", março de 2016
Carlos Eduardo S,"Cajati, SP",Parque Barigui,"O termo barigui tem origem indígena. Os índios locais deram esse nome ao rio que atravessa o parque e que pode ser traduzido como rio do fruto espinhoso, referindo-se as pinhas que caem dos muitos pinheiros do local. Um ótimo lugar para os nossos fim de semana.", maio de 2016
Rafael_VPO,,Um ótimo parque p/ passear,"Um belo parque para a pratica de exercícios, ou mesmo fazer uma visita e ficar na grama. Tem um centro de exposições que sempre tem feiras.", abril de 2016
Vi B,"Curitiba, Parana, Brazil",um dos primeiros parque de Curitiba,"parque com muito verde ,um belo lago ,com capivaras soltas e ate um jacare tambem solto , com pistas de caminhada e praticas esportivas ,um otimo lugar para passear fim de semana ver muita gente ou ate ficar no gramado relachando ,gosto muito deste parque", fevereiro de 2016
Maria_Ynez,"São Roque, SP",LINDOOO,"um dos mais lindos parques de Curitiba, completo eu diria, caminhada, skate, patins, bikes, animais, descanso.", abril de 2016
Ryu I,,Tranquilidade,"Quando visitei esse local, senti tranquilidade. Lugar com paisagem que te faz relaxar. Amplo, bem conservado. Senti falta de alguns equipamentos de interação. Mas é ótimo para quem busca um passeio tranquilo.", junho de 2015
Adriano S,"Curitiba, PR",Parque,"Excelente parque para atividades físicas, a pista possui uns 5 km, porém no fim de semana é necessário paciência para enfrentar o transito de pedestres e de bicicleta cuidado com as pessoas que insistem em caminhar na área de bicicleta.", abril de 2016
Ivan M,"Brasília, DF",Um dos maiores parques de Curitiba,Um dos mais procurados pelos curitibanos. Bom para caminhadas. Nos espaços para picnic e churrascos é normal que se vejam balões de aniversário., janeiro de 2016
Keilla F,,Quintal d casa,"Um dos mais belos parques da cidade, com amplos estacionamentos, churrasqueiras, restaurantes, Centro de eventos e uma imensa área Verde.  Pode se observar jogadores d futebol americano, famílias fazendo passeios, praticantes d atividades físicas, capivaras e jacarés. Sim, pura", fevereiro de 2016
shay_vidal,"Campo Largo, PR",dias ensolarados,"otimas memorias , dias divertidos , lugar legal para pasear com caes familiares , parque lindo e bem limpo", abril de 2016
AlendeGomes,"Curitiba, PR",Skyline,Lugar perfeito para ir com os amigos fazer um picnic e andar no skyline.. e se divertir bastante. super recomendo., novembro de 2015
Mariana_234234,"Campinas, SP",Lindo,"Parque simplesmente maravilhoso, Curitiba possui diversos parques, mas acredito que o Barigui seja um dos mais charmosos...fica do lado do Barigui Shopping que é ótimo também.", novembro de 2015
Ricardo S,"Londrina, PR",Excelente parque.,"Muito bem cuidado, com estacionamento fácil. Fomos no domingo de manhã e nosso filho adorou, com muito espaço e vegetação. Excelente para caminhadas. Só sentimos falta de bancos e um local para apreciar a paisagem sem ter que caminhar muito.", julho de 2015
adlermuller,"Curitiba, PR",O melhor,O melhor e maior parque de Curitiba. Excelente para caminhar / correr. Abriga algumas exposições durante o ano. Possui algumas opções de alimentação., março de 2016
Paulo L,"Florianópolis, SC",Parque enorme,"Parque muito bacana para quem gosta de praticar esportes. Pistas separadas para caminhada, corrida, bike/roller além de possuir restaurantes/lanchonetes na beira do lago.  Lugar muito limpo e agradável.", maio de 2016
MariaFernanda R,"Curitiba, PR",Passeio de domingo ,"Ótimo parque para passear, fazer um exercício.. E dar uma paradinha no restaurante Maggiore, ótimo restaurante ou no barzinho do parque, o dono procura ser super atencioso. Mas é bom parque, adoro é super recomendo... Tem uma área verde de da up.. ", março de 2016
Alessandro Romano,"São Paulo, SP",Parque,"Um dos mais belos parques de Curitiba, conta com uma ampla área de lazer, podendo ter um dia maravilhoso com amigos, familiares ou entre casais.", abril de 2016
Ariany A,,Adoro,"Lugar calmo, limpo e lindo, ótimo para exercícios e descanso finais de semana, sempre que posso visito e gosto muito, pode levar cachorros", fevereiro de 2016
Gaston Z,"Visconde de Mauá, RJ",Lindo,"Lugar calmo , limpo , agradável , lugar mais incrível da cidade !!! Quem for visitar a cidade deve visitar.", maio de 2016
Alef B,,Melhor corrida,"Lugar lindo e com grande pista para treino de corrida. Excelente para família, casal, amigos, treinos e tudo mais. Vale a pena!!", setembro de 2015
vickjg,"Curitiba, PR",Não vá aos Domingos!,"É um lugar lindo, mas aos Domingos é muito lotado e com muita gente sem noção. Impossivel andar de bike! Quase atropelei uma mulher que ficou parada no meio da ciclovia.", abril de 2016
Fschlosser,"Blumenau, SC",Não tem igual!,"O parque é o melhor do Brasil! Excelente estrutura, segurança e é enorme! Um lugar para relaxar, praticar atividades fisicas, culturais, curtir os pets, esportes radicais e etc. Uma pena não ter um deste na minha cidade. Vá de tênis e roupas leves, o passeio vale a pena!", maio de 2016
abicaetano,"Curitiba, PR",para pessoas fitness,ambiente otimo para fazer aquela corrida pela manha tarde e ate a noite com uma bela paisagem de encher os olhos , fevereiro de 2016
allan_ndm,"Almirante Tamandaré, PR",Lindo parque,"Um dos maiores parques que tem em Curitiba, e é muito bom para visitar com a família e passar um dia excelente.", janeiro de 2016
Marcelo D,"Alegrete, RS",Lindo parque e realmente único.,"Não é só mais um parque, como tudo em curitiba é extremamente limpo, caminhar, correr, andar de patins ou skate, tomar chimarrão, ou apenas não fazer absolutamente nada. Vale levar uma manta e fazer um pic nic, uma ótima experiência, se for de carro leve a paciência para achar", abril de 2016
Ste_dry,"Curitiba, PR",caminhada,"um belo parque para a realização de exercícios físicos , piqueniques, para passear com a família....", outubro de 2015
Giancarlo,"Itatiba, SP",Parque Barigui,"Belo parque , muito bem conservado,da vontade de ir todos os dias se morasse em Curitiba. Gostei de tudo,tem que ir sem falta.", abril de 2016
Amauri Moleta,"Curitiba, PR",Cartão Postal da Cidade,"É o maior cartão postal de Curitiba. Um excelente local para a prática de esportes, porém no domingo a tarde é muito cheio.", dezembro de 2015
Daniela D,,Lugar super alto astral.,"No meio da cidade um parque enorme, muitos lagos e muita vegetação. Existem quiosques espalhados pelo parque que dão opões de lanches. Próximo a algumas outras atrações da cidade, portanto é interessante reservar ao menos um dia da viagem para conhecer as redondezas do parque.", abril de 2016
Paula R,"Cabedelo, PB",Natureza,"Um parque lindo para passeios,com um lago, vias para caminhadas, muitas árvores e um espaço para feiras super legal.", junho de 2015
Wilton G,"Curitiba, PR",Correr com ótimo visual ,"Excelente para prática de esportes, especialmente corrida, com cenários sensacionais misturando a natureza com o urbano. ", maio de 2016
AnaCPim,"Curitiba, PR",Para todos os gostos,"Quer fazer um churrasco? Tem diversas churrasqueiras distribuídas entre 2 partes do parque. Tem crianças? Tem um parquinho e muito espaço para correrem. Quer algo saudável? As pistas, uma para corrida, uma para caminhada e outra para bicicletas e afins, são uma ótima opção para", maio de 2016
Alexandre B,"São Bento do Sul, SC",Excelente,"Parque muito bonito, ampla área para corridas e caminhadas, excelente para curtir um final de semana de sol com a família. Possui parquinho com balança e escorregador para as crianças.", abril de 2016
simone R,"Porto Alegre, RS",Sábado maravilhoso,"   Lugar espaçoso...ideal para atividades físicas, fiquei impressionada com a dimensão do parque,também é muito bom para ler,tirar uma soneca,caminhar,namorar ou não fazer nada!!simplesmente curtir!!", abril de 2016
GutemBerg A,,Muito lindo,"Nunca meus olhos viram uma coisa tao bonita como isso, a integração da floresta com a cidade logo ali tem a park shopping barigui.", abril de 2016
Thais T,"Miami, Flórida",Ótimo para a prática de exercícios,"Um bom parque para praticar esportes, seja a sua preferência correr, andar de roller, de bicicleta ou de skate. Possível sempre avistar capivaras.", março de 2016
AlyCarolina,"Curitiba, PR",Lugar preferido!,"É o parque pra relaxar, caminhar, correr, passear e respirar! Parque Barigui é um dos parques mais bonitos da cidade", maio de 2016
Vitor M,"Curitiba, PR",Para todos,"Um grande espaço de natureza no meio da cidade, perfeito para passeios em família, amigos e parceiros, além de oferecer diversas atividades esportivas e relaxantes, como meditação e ioga.", abril de 2016
Vinícius P,"Curitiba, PR",Ótimo para práticas esportivas,"O parque fica um pouco distante do centro da cidade, mas vale a pena conhecer, principalmente se o visitante tiver a curiosidade de conhecer as tão famosas capivaras de Curitiba, ou se curte práticas esportivas ao ar livre.", fevereiro de 2016
Fabio S,,Férias de julho,"Apesar de ter sido uma pequena passagem, a paisagem é perfeita para algumas fotos. Pretendo voltar e apreciar com mais tempo, pois é um belo lugar.", julho de 2015
Alexandre F,,Ótimo parque,"Grande parque da cidade de Curitiba. Usado por muitos moradores para prática esportiva, é excelente para uma caminhada. Nele circulam alguns animais tranquilamente, como capivaras. Conta ainda com o Museu do Automóvel, o qual possui diversos carros clássicos como o Ford T.", maio de 2016
Sergio T,"Rio de Janeiro, RJ",Charme e prazer visual ,"Canto agradável da metrópole para se andar, correr, suar. Ver e ser visto. Atletas elegantes, bikes, estacionamento fácil. Sensação de segurança, passeio agradabilíssimo, especialmente no outono. ", maio de 2016
vera m,"São Paulo, SP",Parque dos Curitibanos,"O parque, como a maioria dos locais de Curitiba, é lindo, bem cuidado, amplo, com grande oferta de vagas para estacionar. No dia da minha visita estava recebendo a Feira das Malhas no pavilhão de exposições. Vale a visita", abril de 2016
pauloF3063PB,"Florianópolis, SC",Típico programa curitibano,"Curitiba é modelo de urbanidade,apesar de todos os deslizes do nosso Brasil, e o Parque Barigui é um bom exemplo disso : lugar onde se pode caminhar (vendo muita gente bonita !) ,correr, fazer exercícios ao ar livre ,enfim , é imperdível ! Se vc tiver disposição ,tem lugar para", abril de 2016
Luíza C,,Exercícios ou descanso.,"Melhor lugar pra passear em dias de sol. Domingos podem ficar meio lotados, mas um fim de tarde no parque tomando agua de coco não tem igual.", abril de 2016
Michelly Dias P,"Curitiba, PR",lindo lugar,"ótimo lugar para passear , descansar , correr , andar de bicicleta , roller , skate etc.... simplesmente nota 10 pra ir com a família amigos namorar ....enfim", maio de 2016
Michelle C,"Florianópolis, SC","Ótimo para dar um passeio com os dogs, ou simplesmente relaxar","Gosto bastante do parque, mas as pessoas não respeitam os espaços: faixa para bike tem pedestres caminhando em marcha lenta, atrapalhando o dinamismo do espaço.", abril de 2016
franciscomB9593MQ,"Rio de Janeiro, Brasil",Passeio de família.,Vale a pena o passeio. Vá com disposição para caminhar ou correr. É um espaço enorme de lazer. Distante do centro de Curitiba., abril de 2016
Carmelo Pinheiro,"Londres, Reino Unido",Vale a pena!,Um dos parques mais bonitos da cidade. Ao finais de semana o parque divide-se entre seus visitantes praticantes de corridas e caminhadas com o churrasqueiros de plantão. Vale a pena conhecer., maio de 2016
DayaneMarques,"Curitiba, PR",O lar das capivaras!,"Além de ser o lar das nossas famosas capivaras, o Parque Barigui é um ótimo local para a prática de atividades físicas e também para um pique nique!", julho de 2015
WVWV,"Rio de Janeiro, RJ",INESQUECÍVEL PARISO,"Todo de bom. um verde encantador. lugar extenso. ,bom para fazer caminhadas. ambiente agradável . pessoas passendo .canto dos passaros nas belas arvores. um contado puramente com a natureza. simplesmente AMEI.", maio de 2016
LuisaneV,"Belo Horizonte, MG",Lindo e pensado em escala humana,"Todos os parques que visitei em Curitiba são limpos e bem cuidados, e os curitibanos fazem uso deles com piqueniques, bikes, crianças. O Barigui tem uma ótima pista de corrida e caminhada e aluguel de bikes, melhores nas horas de pouco movimento. O shopping Barigui fica perto.", abril de 2016
Coracy B,"Curitiba, PR",passeio para todo público,"Local agradável com opções de alimentação, ótimo espaço para corrida e caminhada, além de churrasqueiras para uso gratuito.", fevereiro de 2016
Edson Giroldo,"Fazenda Rio Grande, PR",Um dos mais famosos,"O Parque Barigui é um dos mais famosos parques de Curitiba e conta com uma grande extensão, ótimo pra fazer caminhadas, curtir o ambiente e admirar natureza.", dezembro de 2015
FernandoTds,"Curitiba, PR",Nosso parque número 1 é um excelente lugar para curtir a natureza,"Nosso parque número 1 é um excelente lugar para curtir a natureza, para ver gente, para ir com crianças, para levar os animais e para prática de exercícios físicos.  Só o turista deve ficar atento ao fato que aos domingos de sol a tarde, inverno ou verão, o parque fica", abril de 2016
Edson R N,"Curitiba, Brasil",Ótimo nos fins de semana,Pra quem curte um passeio agradável em família está ai um otima pedida...experimente andar de bikes elétrica...é show de bola., março de 2016
Vivian Raia C,"Curitiba, PR",Ótimo Parque,"Um ótimo parque para corridas, lazer, passeio, diversão com a família. Proporciona uma boa área para churrasco.", setembro de 2015
KARINA B,"Cuiabá, MT",Caminhada,"ótimo programa para a família e para as crianças. Tem Pista de caminhada, corrida e bicicletas. Natureza encantadora.", dezembro de 2015
janainasimov,"Campina Grande, PB",O melhor de Curitiba!!!,"Há várias possibilidades de aproveitar esse parque, mas o aluguel de bicicletas elétricas no mínimo de uma hora é uma excelente experiencia. O tempo ideal para aproveitar o parque é um dia todo. Faça piquenique, pois os gramados são perfeitos, a diversidades de ambientes também.", outubro de 2015
Rafaela O,"Curitiba, PR",Muito Grande!!,"Muito Grande!! Fui no verão de Curitiba. É um ambiente agradável para passear com a família, tem restaurantes para almoçar e espaço para andar de bicicleta,patins e fazer caminhadas.", fevereiro de 2016
Luiz Cláudio P,"Curitiba, PR",Parque Barigui,"Quando não viajo, normalmente vou ao Parque Barigui (como no fim de semana passado). Nos finais de semana possui muito movimento (quando não chove). Dicas: conheça o Museu do Automóvel; veja se tem alguma exposição no pavilhão em seu interior; tem 3 estacionamentos (além de ruas", abril de 2016
Fernanda Stelle O,"Florianópolis, SC",Imersão Curitibana,"Aos domingos de sol é possível misturar-se aos Curitibanos levando uma esteira para tomar sol na grama. Crianças, pets, ciclistas e amigos se encontram para momentos de lazer, fotos, piquenique ou um sorvete. Experiência obrigatória.", fevereiro de 2016
Anderson D,"Curitiba, PR",Final de semana de lazer.,"Na minha opinião um dos melhores parques para uma passeio de final de semana, o trajeto é separado em três pistas para esportes com rodinhas, ciclovia e caminhada, que rodeiam um lago que juntamente com as aves e as capivaras que o habitam deixam o exercício muito mais", abril de 2016
Eclair P,"Jaboatão dos Guararapes, Brasil",Parque bonito!,"Só passei de ônibus do turismo,  mas gi cheio de crianças brincando,  tds curtindo um domingo de calorão!  ", abril de 2016
Renan A,"Curitiba, PR",Ótimo passeio,"Parque bem arborizado, visual muito bonito para fotos, bom para caminhada, bicicleta, skate e outras atividades ao ar livre, possui churrasqueiras espalhadas em locais estratégicos, ótimo para passar o dia, chegue cedo para pegar a sua, não há esquema de reserva é de quem chegar", janeiro de 2016
crisfilrocha,"Teresópolis, RJ",Parque Barigui Curitiba,"Passeio para famílias, amantes da natureza ,muito limpo , para quem gosta de caminhadas, correr, andar de patins, bicicletas, fazer pic-nic ,para quem gosta de fotografar o lugar é incrível , vale a pena visitar.O ônibus de turismo serve para este destino.", abril de 2016
gpadua,,Gigante e lindo!,"Um parque muito limpo e organizado, com uma pista para ciclistas e pedestres! O parque eh muito verde,  agradável.", abril de 2016
TaisebLima,"São Paulo, SP",Um pedaço de calmaria ,"O parque é amplo, simples de certa forma, muito bem cuidado. Muito bom pra dar uma volta sem compromisso, praticar esportes ou só sentar na grama e admirar a beleza do lago.", abril de 2016
FlaviaRegina456,"São Paulo, SP",Um lugar para todos,"Desde para praticar esportes, curtir um dia de sol ou a companhia dos amigos esse parque é ideal. Um lugar aconchegante para tudo", abril de 2016
Fernanda S,"Curitiba, PR",Praia de Curitiba,"Gostoso para fazer exercícios, fazer um pic-nic com os amigos ou simplesmente passear com a família.", março de 2016
Messias J,,Caminhada ao ar livre,"Parque muito limpo, com uma boa infraestrutura, perfeito para caminhar, correr, andar de patins, bicicleta, etc.", abril de 2016
LeandroGuia,"São Roque, SP",Otimo para Andar e Pensar na vida,"É um lugar lindo , onde você pode relaxar ou ate mesmo passear com a família .Um espaço íncrivel, ao seu entorno tem varias coisas entre bares, restaurantes, shoppings e etc...", dezembro de 2015
Rodrigo F,,Ótimo parque ,Ótimo parque para ir em familia ou dazer exercícios. Para quem gosta tem alguns bares e lanchonetes. Aos domingos geralmente é bastante cheio, junho de 2015
mendonca2303,"São Paulo, SP",Passeio agradável ,O parque não é muito grande. Mas usado para quem quer fazer caminhada ou corrida em volta do lago. Possui bares para um lanche ou cerveja! , abril de 2016
André M,"Florianópolis, SC",Relato de um curibano,"Se vc procura um Curitibano num fds , acredite, se saiu de casa , grande possibilidade  de ou estar em um shopping ou no parque Barigui. É o maior da cidade. Diversas opções para tds os gostos e idades. Feiras , eventos, corridas,caminhadas, roller, bicicletas, bar, pique nique.", abril de 2016
Murilodimensao,"São Mateus do Sul, PR",Não vi o jacaré!,"Lugar lindo, ótimo para passar a tarde. Muito limpo e com ótima estrutura. Há ainda barzinhos. Programa para todas as idades", janeiro de 2016
Ewan Nascimento,"Curitiba, PR",Maior Parque da cidade,"Ótimo para exercícios durante a semana, boa opção para se divertir e ver gente bonita nos finais de semana.", março de 2016
Renata F,"Salvador, BA",Lindo e gostoso passeio.,"O parque está lindo, super confortável, uma paz imensa no meio da cidade. Tem garça, tem marreco, tem pato, tem capivara que fica deitadinho ao lado das crianças, e teoricamente tem até jacaré . Cheio de graça e beleza.", abril de 2016
Cleber F,"São Paulo, SP",Pare e relaxe! Ou não...,"Excelente opção para relaxar ou praticar esportes, com churrasqueiras, bares e muita sombra, além de pistas para caminhada/corrida e bike, etc.", abril de 2016
Rjsridro,"Alfredo Chaves, ES",Local aprasível e limpo...,O Parque Barigui é um excelente local para caminhadas e para estar com a família. vale uma visita. O local é lindo!!!, abril de 2016
PauloRoberHelrighel,"Curitiba, PR","NO BARIGUI, vivendo BEM todas belezas desta vida...","Amplo espaço para caminhadas às margens do lago, churrascadas sob as frondosas árvores, estirando~se nas redes, tomando seu chimarrão e proseando com familiares e amigos. IMPERDÍVEL !", maio de 2015
N6019LWclair,"Curitiba, PR",O Parque preferido dos Curitibanos para caminhadas.,"Estive várias vezes com o pessoal da ginastica,para caminhadas em homenagem ao dia da mulher e em prol da divulgação dos benefícios da ginastica para a saúde.Este parque foi implantado em 1972,é um dos maiores da cidade.Também foi escolhido pelos Curitibanos para caminhadas", março de 2016
Camila S,"Santos, SP",Capivaras! !,"O parque é ótimo para se exercitar, tem pista de bike,  corrida e caminhada. Além de aparelhos para fazer musculação. A vista é bonita e tem muitas capivaras por lá.  Próximo ao shopping barigui. ", abril de 2016
evandromacwb,"São José dos Pinhais, PR",Bom parque,"Um dos preferidos parques curitibano, é um pouco mais afastado do centro, mas perfeito para quem quer caminhar e fazer uma atividade física, o parque é grande e permite uma caminhada tranquila, tendo até companhias de capivaras", abril de 2016
Cristiane M,"Porto Alegre, RS",Um dos parques mais bonitos que já visitei,"Adorei passear por este parque! Um lugar lindo, com bastante verde e um lago incrivel! Vale a pena ir a curitiba e dar uma passada lá ", abril de 2016
gabriellacwb,"Curitiba, PR",clássico passeio de fds,"ideal para esportes, corridas, skate, patins, bicicleta ou caminhada, possui um deck no lago para quem deseja tomar uma cerveja ou um suco... o por do sol é lindo visto do lago.", maio de 2015
Edvane A,,Lugar Belíssimo!,Ótimo lugar para atividades ao ar livre ou apenas deitar na grama e relaxar. Um belo cartão postal de Curitiba., abril de 2016
Juliana C,"Curitiba, PR",Caminhada,"Ótimo para fazer caminhada, andar de bicicleta, skate, namorar, passear com os amigos, descansar, tirar fotos. Não tem muitas atrações para quem visita.", agosto de 2015
Rhayan Saporiti,"Curitiba, PR",Destino certo,"Destino certo para esportistas, famílias, crianças, cachorros e capivaras. Prefira dias ensolarados e chegue cedo para achar lugar para estacionar. Um parque belíssimo e relativamente seguro, vale a pena conferir.", março de 2016
julielycsilva,"Curitiba, PR","""Lindo""","Lugar lindo, gigantesco, para todas as idades e pessoas passeios em família< ver o por do sol com o namorado. e um belo Barzinho a beira do lago.", junho de 2015
Michele_spa,"Rio de Janeiro, RJ",Uma ótima pedida!,Não há programação melhor em Curitiba num domingo a tarde! Ambiente super gostoso pra fazer uma caminhada e relaxar!!, fevereiro de 2016
_igerchev,"Irati, PR",Contato com a natureza,"Ótimo para  caminhadas em contato com a natureza, lugar seguro além de muito bonito. Uma ótima localização. Lugar para praticar atividades físicas", agosto de 2015
Walter M,"Curitiba, PR",Melhor parque de Curitiba,"Para quem deseja realizar uma caminhada, uma corrida ou simplesmente passear é um excelente lugar. Duvido você não se apaixonar.", abril de 2016
